titulo,enlace,fecha,descripcion,categoria,fuente,imagen,contenido
Banca en Latinoamérica acelera su transformación digital con IA y análisis de datos,https://gestion.pe/peru/banca-en-latinoamerica-acelera-su-transformacion-digital-con-ia-y-analisis-de-datos-noticia/,"Fri, 07 Nov 2025 20:48:59 +0000","La banca en América Latina atraviesa una transformación estructural impulsada por la inteligencia artificial (IA) y el uso intensivo de datos. Las entidades financieras que aún operan con procesos manuales o sistemas desconectados enfrentan mayores costos, riesgos de fraude y pérdida de competitividad frente a competidores digitales.",Sin categoría,Gestión,https://gestion.pe/resizer/v2/7FRLOWMVWRARJPZJYMICCUHBXA.jpg?width=1200&height=900&auth=cd3f51e2494f6407c7bf9e0b5f554c6424262dc5c512b66b1f12d895788f951d&smart=true,"La banca en América Latina atraviesa una transformación estructural impulsada por la inteligencia artificial (IA) y el uso intensivo de datos. Las entidades financieras que aún operan con procesos manuales o sistemas desconectados enfrentan mayores costos, riesgos de fraude y pérdida de competitividad frente a competidores digitales."
Entrevistas ejecutivas: cómo usar la intuición sin caer en sesgos,https://gestion.pe/g-de-gestion/columnistas/entrevista-laboral-intuicion-y-analisis-en-las-entrevistas-ejecutivas-noticia/,"Fri, 07 Nov 2025 20:48:00 +0000","OPINIÓN. “Es clave definir con precisión las características y comportamientos que predicen el éxito en la posición”, escribe Alvaro Collas, Managing Director ZRG Hispanoamérica.",Sin categoría,Gestión,https://gestion.pe/resizer/v2/4PYZI7OOIBGCBBMLGU7XZKVO7Q.jpg?width=1740&height=990&auth=bc929f51610409ea1d2160de5ac820e444fd116069688e390d53459466259683&smart=true,"OPINIÓN. “Es clave definir con precisión las características y comportamientos que predicen el éxito en la posición”, escribe Alvaro Collas, Managing Director ZRG Hispanoamérica."
Congreso: pleno del 19 de noviembre votará acusación e inhabilitación de Betssy Chávez,https://gestion.pe/peru/politica/congreso-pleno-del-19-de-noviembre-votara-acusacion-e-inhabilitacion-de-betssy-chavez-noticia/,"Fri, 07 Nov 2025 20:38:45 +0000","El informe final que recomienda denunciar constitucionalmente e inhabilitar por diez años a la expresidenta del Consejo de Ministros, Betssy Chávez, se debatirá y votará en el pleno del Congreso que se realizará el miércoles 19 del presente mes.",Sin categoría,Gestión,https://gestion.pe/resizer/v2/7ZZCDNS5ZVDATFGDRY4EWPYIIM.jpg?width=1732&height=1155&auth=32c729eb27d1fc46e4fd7cbb4b0c268245d375df285fa406cdf7591b0f45b4a3&smart=true,"El informe final que recomienda denunciar constitucionalmente e inhabilitar por diez años a la expresidenta del Consejo de Ministros, Betssy Chávez, se debatirá y votará en el pleno del Congreso que se realizará el miércoles 19 del presente mes."
Poder Judicial anula juicio político contra Salvador del Solar: los detalles,https://gestion.pe/peru/politica/poder-judicial-anula-juicio-politico-contra-salvador-del-solar-los-detalles-noticia/,"Fri, 07 Nov 2025 20:37:21 +0000","El Poder Judicial declaró nulo el juicio político que el Congreso realizó contra el expremier Salvador del Solar, tras admitir en parte la demanda de amparo interpuesta por él.",Sin categoría,Gestión,https://gestion.pe/resizer/v2/DW3H35CYTFFBHMAVK5LSWOU2BE.jpg?width=1000&height=562&auth=12e06c46848434be42e4ff706bee7a3439205330b9b92e44db9fcba9dde670c8&smart=true,"El Poder Judicial declaró nulo el juicio político que el Congreso realizó contra el expremier Salvador del Solar, tras admitir en parte la demanda de amparo interpuesta por él."
¿Qué pasó con la compra de aviones de combate?: Saab defiende su plan de industrialización,https://gestion.pe/peru/que-paso-con-la-compra-de-aviones-de-combate-saab-defiende-su-plan-de-industrializacion-noticia/,"Fri, 07 Nov 2025 20:25:23 +0000","En ese contexto de pausa prolongada conversamos en CADE Ejecutivos 2025 con Andrés Vélez, jefe de ventas de Saab en Perú y director adjunto de Gripen Perú, quien explica cómo la compañía está procesando esta incertidumbre y qué ofrece realmente Suecia al país.",Sin categoría,Gestión,https://gestion.pe/resizer/v2/F3ES7MVBGVAR3CUGUXJOKGRXWY.png?width=1200&height=800&auth=d7750c7e7501489a9f582b3394b5dee55709170b0ea7942fcd90cb2a179ef906&smart=true,"En ese contexto de pausa prolongada conversamos en CADE Ejecutivos 2025 con Andrés Vélez, jefe de ventas de Saab en Perú y director adjunto de Gripen Perú, quien explica cómo la compañía está procesando esta incertidumbre y qué ofrece realmente Suecia al país."
Cenco Malls acelera su crecimiento en Perú: ventas suben 5.8% y avanza segunda etapa de Cenco La Molina,https://gestion.pe/economia/empresas/cenco-malls-acelera-su-crecimiento-en-peru-ventas-suben-58-y-avanza-segunda-etapa-de-cenco-la-molina-noticia/,"Fri, 07 Nov 2025 20:22:17 +0000","Cenco Malls tuvo un trimestre positivo en Perú, con crecimiento en ventas y avances en la expansión de Cenco La Molina, lo que reafirma su estrategia de fortalecer su presencia en un mercado competitivo y en constante desarrollo.",Sin categoría,Gestión,https://gestion.pe/resizer/v2/OG44L2M4YNAVJGMNFT26EQM4YA.jpg?width=1200&height=800&auth=08b04c259c34620d7455f8be0accbbac2602bf554562e00a253b6bbdb6ebec6f&smart=true,"Cenco Malls tuvo un trimestre positivo en Perú, con crecimiento en ventas y avances en la expansión de Cenco La Molina, lo que reafirma su estrategia de fortalecer su presencia en un mercado competitivo y en constante desarrollo."
¿Se agravará el daño a la sostenibilidad fiscal de Perú? Uno de cada tres expertos cree que sí,https://gestion.pe/economia/se-agravara-el-dano-a-la-sostenibilidad-fiscal-de-peru-uno-de-cada-tres-cree-que-si-noticia/,"Fri, 07 Nov 2025 19:49:33 +0000","El Consejo Privado de Competitividad (CPC) compartió en exclusiva con Gestión su Encuesta de Expectativas Fiscales, que tiene por objetivo recabar la opinión y estimaciones de expertos nacionales e internacionales en la materia.",Sin categoría,Gestión,https://gestion.pe/resizer/v2/AUDWJPN3YBECROVDMIJ4NMPK6Y.jpg?width=1200&height=800&auth=c635a8c15aee429127f19b547fb23d5bf7fdb2d9dd89104e67bcce6abd272c19&smart=true,"El Consejo Privado de Competitividad (CPC) compartió en exclusiva con Gestión su Encuesta de Expectativas Fiscales, que tiene por objetivo recabar la opinión y estimaciones de expertos nacionales e internacionales en la materia."
"Octavo retiro de AFP 2025: cómo registrar hoy tu solicitud si tu DNI termina en 6, según el cronograma",https://gestion.pe/mix/mi-bolsillo/octavo-retiro-de-afp-2025-cuando-y-como-registrar-solicitud-hoy-si-tu-dni-termina-en-6-segun-fecha-del-cronograma-nnda-nnrt-noticia/,"Fri, 07 Nov 2025 20:17:07 +0000",Conoce cómo debes hacer correctamente tu solicitud de retiro de AFP 2025 si tu último dígito del DNI es el número 6 según el cronograma. Aquí te cuento todos los detalles.,Sin categoría,Gestión,https://gestion.pe/resizer/v2/KXKPLBONB5AXLGPMSHOVGTUGR4.jpg?width=2300&height=1320&auth=5ed49050763f6667592a53898d88779cdf33426ba97002aeb9c5ec2252d197cc&smart=true,Conoce cómo debes hacer correctamente tu solicitud de retiro de AFP 2025 si tu último dígito del DNI es el número 6 según el cronograma. Aquí te cuento todos los detalles.
"💸 Octavo retiro AFP 2025: link oficial, fecha clave y cómo solicitar hasta S/. 21.400 (4 UIT)",https://gestion.pe/mix/mi-bolsillo/octavo-retiro-de-afp-2025-cuando-y-como-registrar-solicitud-hoy-si-tu-dni-termina-en-5-segun-fecha-del-cronograma-nnda-nnrt-noticia/,"Fri, 07 Nov 2025 20:17:03 +0000",Conoce cuándo y cómo registrar tu solicitud del octavo retiro AFP 2025 si tu DNI termina en 5. Revisa la fecha del cronograma y los pasos para hacerlo hoy.,Sin categoría,Gestión,https://gestion.pe/resizer/v2/GLLCU5I6GNBZPFFUEZ7HV6DS6I.png?width=2320&height=1320&auth=76b92ad24a7dc203ae1c77a533899a6de01bf4d7d9a88486c7d7bf6fad12ea3a&smart=true,Conoce cuándo y cómo registrar tu solicitud del octavo retiro AFP 2025 si tu DNI termina en 5. Revisa la fecha del cronograma y los pasos para hacerlo hoy.
Congreso impulsa más de 10 nuevos aeropuertos en varias regiones: : ¿viables o “elefantes blancos”?,https://gestion.pe/economia/congreso-aprueba-construccion-de-aeropuertos-en-tres-regiones-son-viables-o-elefantes-blancos-noticia/,"Fri, 07 Nov 2025 20:16:13 +0000","El Congreso propuso la creación de más de 10 aeropuertos e, incluso, un helipuerto en los últimos dos años.",Sin categoría,Gestión,https://gestion.pe/resizer/v2/3S2MCI3CWRHIHPA2HAS53B2KMU.jpg?width=1800&height=1291&auth=ed783cbcd40dddf3c9c86c801b851306554723592a95f6337629852e2c9c31e4&smart=true,"El Congreso propuso la creación de más de 10 aeropuertos e, incluso, un helipuerto en los últimos dos años."
“El valor de la verdad” llega a las empresas: proponen ley para regular uso del polígrafo laboral,https://gestion.pe/economia/congreso-evalua-proyecto-que-regula-el-uso-del-poligrafo-en-el-ambito-laboral-noticia/,"Fri, 07 Nov 2025 20:15:48 +0000","El Congreso analiza un proyecto de ley que busca regular el uso del polígrafo en el trabajo. La propuesta permitiría su aplicación voluntaria en sectores donde la seguridad y la confianza son esenciales, bajo supervisión del Ministerio de Trabajo y con protección de la confidencialidad de los resultados.",Sin categoría,Gestión,https://gestion.pe/resizer/v2/66W7G3MVOJGLXPASMHSMXCFHPI.jpg?width=1200&height=802&auth=733eddc7f064e964d897457041ce9edbe1ee2f298caa65cd9fb21a3867950c84&smart=true,"El Congreso analiza un proyecto de ley que busca regular el uso del polígrafo en el trabajo. La propuesta permitiría su aplicación voluntaria en sectores donde la seguridad y la confianza son esenciales, bajo supervisión del Ministerio de Trabajo y con protección de la confidencialidad de los resultados."
▷ Link para solicitar tu Retiro AFP 2025 - cronograma oficial para cobrar hasta 4 UIT (S/. 21.400),https://gestion.pe/mix/mi-bolsillo/link-retiro-afp-2025-consulta-aqui-el-cronograma-oficial-y-como-enviar-solicitud-hoy-para-las-s-21400-de-las-4-uit-nnda-nnrt-noticia/,"Fri, 07 Nov 2025 20:10:00 +0000","Descubre cómo solicitar el octavo retiro AFP por 4 UIT (S/ 21,400) de forma segura y en línea desde el 21 de octubre de 2025. Revisa los pasos, requisitos y cronograma oficial para acceder a tus ahorros en Habitat, Prima, Profuturo e Integra.",Sin categoría,Gestión,https://gestion.pe/resizer/v2/FPMRFQWYRRGNLNFG7A35QE4UQU.jpg?width=2400&height=1620&auth=2d3323371453f20f0b503506e9d0a32f9646f69e172378c51740d40bc8e6f2c9&smart=true,"Descubre cómo solicitar el octavo retiro AFP por 4 UIT (S/ 21,400) de forma segura y en línea desde el 21 de octubre de 2025. Revisa los pasos, requisitos y cronograma oficial para acceder a tus ahorros en Habitat, Prima, Profuturo e Integra."
Recomendaciones para peruanos con múltiples nacionalidades sobre ingreso y salida del país,https://gestion.pe/peru/recomendaciones-para-peruanos-con-multiples-nacionalidades-sobre-ingreso-y-salida-del-pais-noticia/,"Fri, 07 Nov 2025 20:09:36 +0000",La Superintendencia Nacional de Migraciones reiteró a los ciudadanos peruanos que poseen doble o múltiples nacionalidades que están obligados a ingresar y salir del territorio nacional utilizando el mismo documento de viaje con el que efectuaron su ingreso a través de los puestos de control migratorio o fronterizo.,Sin categoría,Gestión,https://gestion.pe/resizer/v2/7STLPB24GNFL7LQJAC5RLKIKHE.jpg?width=1200&height=677&auth=3ca1fbdb403b01d62065fe63fb82464c56b936b5acb11f259d068ed12ba867f9&smart=true,La Superintendencia Nacional de Migraciones reiteró a los ciudadanos peruanos que poseen doble o múltiples nacionalidades que están obligados a ingresar y salir del territorio nacional utilizando el mismo documento de viaje con el que efectuaron su ingreso a través de los puestos de control migratorio o fronterizo.
LINK del retiro AFP 2025 hoy: cuándo y cómo enviar solicitud para cobrar los S/. 21.400 de las 4 UIT,https://gestion.pe/mix/mi-bolsillo/link-oficial-del-retiro-afp-2025-hoy-consulta-aqui-como-enviar-solicitud-para-cobrar-los-s-21400-de-las-4-uit-segun-cronograma-sbs-nnda-nnrt-noticia/,"Fri, 07 Nov 2025 20:00:00 +0000","Solicita tu octavo retiro AFP 2025: accede a S/ 21,400 en cuatro pagos. Realiza el trámite totalmente online entre el 21 de octubre de 2025 y el 18 de enero de 2026, cumpliendo el cronograma por DNI.",Sin categoría,Gestión,https://gestion.pe/resizer/v2/ZY4UWBMK7JBZTJHH4MFDULEG5U.jpg?width=2400&height=1620&auth=b81fc34742d0867113e116b6415bb6381f539b4dc6cce6e78c90a1a702bdd5cf&smart=true,"Solicita tu octavo retiro AFP 2025: accede a S/ 21,400 en cuatro pagos. Realiza el trámite totalmente online entre el 21 de octubre de 2025 y el 18 de enero de 2026, cumpliendo el cronograma por DNI."
"La divertida trama de “¡Vaya Navidad!”, la película de Michelle Pfeiffer en Amazon Prime Video",https://gestion.pe/mix/tendencias-mix/vaya-navidad-trama-y-fecha-de-estreno-en-amazon-prime-video-de-la-pelicula-de-navidad-de-michelle-pfeiffer-oh-what-fun-nnda-nnlt-noticia/,"Fri, 07 Nov 2025 19:42:09 +0000",“Oh. What. Fun.” es una película de Amazon Prime Video que sigue a Claire luego de abandonar a su familia después de comprender que no valoran sus esfuerzos.,Sin categoría,Gestión,https://gestion.pe/resizer/v2/Y4PLNLFR4FAHLJWBLW7KMJN6KA.jpg?width=2400&height=1618&auth=cdc1f80a3384c822174173c1af77d3752db05c6d778296978d8b3329c993e9a7&smart=true,“Oh. What. Fun.” es una película de Amazon Prime Video que sigue a Claire luego de abandonar a su familia después de comprender que no valoran sus esfuerzos.
Gobierno aprueba decreto de urgencia y establece medidas extraordinarias de austeridad,https://gestion.pe/economia/gobierno-establece-medidas-extraordinarias-de-de-austeridad-noticia/,"Fri, 07 Nov 2025 19:42:13 +0000",El gobierno emitió esta noche un decreto de urgencia  en el que establece medidas  extraordinarias y urgentes en materia económica y financiera que coadyuven a la austeridad y a la eficiencia del gasto público durante el Año Fiscal 2025.,Sin categoría,Gestión,https://gestion.pe/resizer/v2/GDWWXZIERRFD5OTXQUOOEFKKCQ.jpg?width=1200&height=800&auth=f2d2895049af700fecbe3a9d79497e9af23f195a5657d9318fca9908c868ca7e&smart=true,El gobierno emitió esta noche un decreto de urgencia  en el que establece medidas  extraordinarias y urgentes en materia económica y financiera que coadyuven a la austeridad y a la eficiencia del gasto público durante el Año Fiscal 2025.
Tipo de cambio hoy en Perú: ¿En cuánto cerró el dólar este viernes 7 de noviembre?,https://gestion.pe/economia/mercados/tipo-de-cambio-dolar-hoy-en-peru-cuanto-esta-el-precio-del-dolar-este-viernes-7-de-noviembre-dolares-a-soles-compra-y-venta-bcrp-noticia/,"Fri, 07 Nov 2025 19:35:26 +0000","El viernes 7 de noviembre el dólar en Perú comenzó el día con un incremento, ante dudas sobre la legalidad de los aranceles impuestos por el presidente de Estados Unidos, Donald Trump, de la Corte Suprema de Estados Unidos.",Sin categoría,Gestión,https://gestion.pe/resizer/v2/IPILMFAYGVGZVJIDEMPTSCG7JI.jpg?width=1214&height=697&auth=d1754dfcc2e87f770addc068429db29dd15224a4633bcabc5ba0b8453def1dcb&smart=true,"El viernes 7 de noviembre el dólar en Perú comenzó el día con un incremento, ante dudas sobre la legalidad de los aranceles impuestos por el presidente de Estados Unidos, Donald Trump, de la Corte Suprema de Estados Unidos."
"¿Cada vez menos empleos? Expectativas caen por tercer mes consecutivo, reportó el BCRP",https://gestion.pe/economia/expectativas-de-contratacion-caen-por-tercer-mes-consecutivo-reporto-el-bcrp-noticia/,"Fri, 07 Nov 2025 19:33:14 +0000","Durante los últimos meses las empresas peruanas recortaron sus planes de contratar más trabajadores, ¿cómo van las otras expectativas empresariales?",Sin categoría,Gestión,https://gestion.pe/resizer/v2/OVIRKYHOHBFGTELGKBJRFMSGLY.jpg?width=1800&height=1200&auth=1da9fa490b35d068d5d9b68b50b98b7fb3fdcddc0e0360eb863e2e4939cff44a&smart=true,"Durante los últimos meses las empresas peruanas recortaron sus planes de contratar más trabajadores, ¿cómo van las otras expectativas empresariales?"
Autorizan disolución y liquidación de fondo de seguro para empleados del Mininter,https://gestion.pe/economia/autorizan-la-disolucion-y-liquidacion-del-foscecmi-los-motivos-detras-noticia/,"Fri, 07 Nov 2025 13:54:59 +0000","Mediante el Decreto Supremo N° 014-2025-IN, se autorizó la disolución y liquidación del Fondo de Seguro de Cesación para los Empleados Civiles del Ministerio del Interior (FOSCECMI), en su calidad de organismo de Derecho Público Interno con autonomía administrativa, económica y financiera, dependiente del Despacho Ministerial del Ministerio del Interior.",Sin categoría,Gestión,https://gestion.pe/resizer/v2/D3HELWYBTNAMZP7FNITWZUGTOQ.jpg?width=1200&height=800&auth=0cbc22c4d4aec279f8abede3fcb0a7ccf78c2a57ac155b81898ac9591a5661ed&smart=true,"Mediante el Decreto Supremo N° 014-2025-IN, se autorizó la disolución y liquidación del Fondo de Seguro de Cesación para los Empleados Civiles del Ministerio del Interior (FOSCECMI), en su calidad de organismo de Derecho Público Interno con autonomía administrativa, económica y financiera, dependiente del Despacho Ministerial del Ministerio del Interior."
Lista de feriados 2026: Las fechas festivas y no laborales,https://gestion.pe/peru/feriados-2026-lista-de-fechas-festivas-y-no-laborales-para-este-ano-noticia/,"Fri, 07 Nov 2025 19:25:00 +0000","En estas fechas, los trabajadores tienen el derecho a un día de descanso remunerado.",Sin categoría,Gestión,https://gestion.pe/resizer/v2/KLW4CCYMEBHU7BAB27ZDJOLGXM.jpeg?width=1200&height=675&auth=8b8afbcfe09ad46ff0ec2870095f7bb227dc93a39c374338339010fb9a2ba768&smart=true,"En estas fechas, los trabajadores tienen el derecho a un día de descanso remunerado."
AFP Integra: caída de bonos de Rutas de Lima ya afecta rentabilidad de los fondos,https://gestion.pe/economia/mercados/afp-integra-caida-de-bonos-de-rutas-de-lima-ya-afecta-rentabilidad-de-los-fondos-noticia/,"Fri, 07 Nov 2025 19:22:32 +0000","CADE 2025. El gerente general de AFP Integra, Aldo Ferrini, también hizo una proyección sobre cuál sería el peor impacto en la rentabilidad de los fondos, en caso de una futura desvalorización total de los bonos de Rutas de Lima.",Sin categoría,Gestión,https://gestion.pe/resizer/v2/R776ERXH4JAGBDXUSNC3ESE6O4.jpg?width=1200&height=800&auth=82510ee022677ef2165f9b6c4731475a4f6892799b8f933986d7f3369ada24a7&smart=true,"CADE 2025. El gerente general de AFP Integra, Aldo Ferrini, también hizo una proyección sobre cuál sería el peor impacto en la rentabilidad de los fondos, en caso de una futura desvalorización total de los bonos de Rutas de Lima."
"Lavado de dinero ahora acelera con criptomonedas y creación de empresas, ¿y los inmuebles?",https://gestion.pe/tu-dinero/lavado-de-dinero-ahora-acelera-con-criptomonedas-y-creacion-de-empresas-y-los-inmuebles-noticia/,"Fri, 07 Nov 2025 19:12:51 +0000","La delincuencia organizada no solo viene creciendo en agresividad, como se constata en la creciente cifra de extorsiones, ¿cómo vienen operando?",Sin categoría,Gestión,https://gestion.pe/resizer/v2/BHFA36MAXVE7LM2H5T3BWRUXGM.jpg?width=1800&height=1212&auth=c26fcd5613916b8a28cd3a49598d2f6088cf874f0ade9fdd98703acb375011de&smart=true,"La delincuencia organizada no solo viene creciendo en agresividad, como se constata en la creciente cifra de extorsiones, ¿cómo vienen operando?"
Fernando Eguiluz: “Hoy los más de 40 posibles candidatos presidenciales están siendo observados”,https://gestion.pe/economia/fernando-eguiluz-del-bbva-hoy-los-mas-de-40-posibles-candidatos-presidenciales-estan-siendo-observados-noticia/,"Fri, 07 Nov 2025 19:12:17 +0000","La contienda electoral del 2026 se torna distinta para los inversionistas en comparación a la del 2021, sostiene Fernando Eguiluz, CEO del BBVA Perú. ¿La razón? Prever todos los escenarios posibles con vista a un cambio de Gobierno.",Sin categoría,Gestión,https://gestion.pe/resizer/v2/NWD5ZGZWUZEFBIVTIPIVDMIWBU.png?width=1200&height=800&auth=3d284b2aa01d62073c50ec6341f3eddac582aee55d830757fd7e0608990fe3a5&smart=true,"La contienda electoral del 2026 se torna distinta para los inversionistas en comparación a la del 2021, sostiene Fernando Eguiluz, CEO del BBVA Perú. ¿La razón? Prever todos los escenarios posibles con vista a un cambio de Gobierno."
Minería ilegal: Minera Poderosa critica que el Congreso ayude a su subsistencia,https://gestion.pe/economia/minera-poderosa-critica-que-el-congreso-ayude-a-la-subsistencia-de-la-mineria-ilegal-noticia/,"Fri, 07 Nov 2025 19:11:19 +0000","La presidenta del directorio de Minera Poderosa, Eva Arias, observa con “muchísima preocupación” su avance, el cual ocurre a una escala internacional y más allá del oro.",Sin categoría,Gestión,https://gestion.pe/resizer/v2/6QVWKE6DGJDDFJZL5KR47PLKEQ.png?width=1200&height=800&auth=1c0d25972e3562b4c536f370f2806baf24688838b6a2caf57105c476ae6b2c0d&smart=true,"La presidenta del directorio de Minera Poderosa, Eva Arias, observa con “muchísima preocupación” su avance, el cual ocurre a una escala internacional y más allá del oro."
Lote 192: Upland solicitará a Perupetro revisar el proceso por el cual la descalificó,https://gestion.pe/economia/upland-solicitara-a-perupetro-revisar-el-proceso-por-el-cual-la-descalifico-para-el-lote-192-noticia/,"Fri, 07 Nov 2025 18:37:45 +0000",Empresa asegura que tiene el capital y financiamiento para cumplir con el programa de inversión para ese yacimiento.,Sin categoría,Gestión,https://gestion.pe/resizer/v2/HGZ2TKB7YVFNRAQHSTCILTWXVI.jpg?width=1800&height=1200&auth=a52f03af2ac1230d42bdd8039bbffa98db59872a3c1b8702c37e8928ac0978a9&smart=true,Empresa asegura que tiene el capital y financiamiento para cumplir con el programa de inversión para ese yacimiento.
El dinero con el que sueñas: el gran premio estimado del Mega Millions para este viernes 7 de noviembre,https://gestion.pe/mix/loterias/el-dinero-con-el-que-suenas-el-gran-premio-estimado-del-mega-millions-para-este-viernes-7-de-noviembre-estados-unidos-nnda-nnrt-noticia/,"Fri, 07 Nov 2025 19:02:50 +0000",La información que leerás en esta nota es la oficial. No desaproveches la oportunidad.,Sin categoría,Gestión,https://gestion.pe/resizer/v2/62HEDZWFAVGHVHPXK7TYI4XY54.jpg?width=2400&height=1620&auth=3a2eff2d973b3e42c3ed4d6af7ffa7c397b5d5d0a04050614e2be99163b039eb&smart=true,La información que leerás en esta nota es la oficial. No desaproveches la oportunidad.
Orygen eleva resultados operativos y acelera inversión en energía renovable,https://gestion.pe/economia/empresas/orygen-eleva-resultados-operativos-y-acelera-inversion-en-energia-renovable-noticia/,"Fri, 07 Nov 2025 18:56:38 +0000","Orygen ajusta su desempeño en un trimestre marcado por menor venta de energía. Mientras tanto, avanza en su portafolio renovable y sostiene indicadores operativos.",Sin categoría,Gestión,https://gestion.pe/resizer/v2/SVK7EJPYYFAERHFIAYONUTZSUE.jpg?width=1200&height=800&auth=8bd48bc245ebdbcc5e350fba2079007301dfb62f0e98aef4bf8c9d821f81ea77&smart=true,"Orygen ajusta su desempeño en un trimestre marcado por menor venta de energía. Mientras tanto, avanza en su portafolio renovable y sostiene indicadores operativos."
"Milei se reúne con empresarios en Nueva York, entre ellos los de Morgan Stanley o Pfizer",https://gestion.pe/mundo/internacional/milei-se-reune-con-empresarios-en-nueva-york-entre-ellos-los-de-morgan-stanley-o-pfizer-noticia/,"Fri, 07 Nov 2025 18:42:47 +0000","El presidente de Argentina, Javier Milei, se reunió este viernes en Nueva York con un grupo de empresarios de compañías como Morgan Stanley o Salesforce.",Sin categoría,Gestión,https://gestion.pe/resizer/v2/MBTUUDSC7BAEDPZSQF6BFNQAXE.jpg?width=2963&height=1987&auth=76fc40bd6745f6291d7dd39bb614429b4d632febae972294d97daf594b535923&smart=true,"El presidente de Argentina, Javier Milei, se reunió este viernes en Nueva York con un grupo de empresarios de compañías como Morgan Stanley o Salesforce."
Se desploma el turismo en Cuba y agrava su crisis económica,https://gestion.pe/mundo/internacional/se-desploma-el-turismo-en-cuba-y-agrava-su-crisis-economica-noticia/,"Fri, 07 Nov 2025 18:39:55 +0000","Los viajes internacionales a Cuba se desploman, lo que pone a la isla comunista, afectada por graves problemas económicos, en camino de registrar el peor desempeño desde la pandemia.",Sin categoría,Gestión,https://gestion.pe/resizer/v2/XWTNUAUVXZCNROKKX4WNJCVL6Q.jpg?width=1200&height=800&auth=965673671d85f4108ba8e7ce143d4fc4f2c64165b3cbaf16c6bd20a87699ba48&smart=true,"Los viajes internacionales a Cuba se desploman, lo que pone a la isla comunista, afectada por graves problemas económicos, en camino de registrar el peor desempeño desde la pandemia."
