titulo,enlace,fecha,descripcion,categoria,fuente,imagen,contenido
Científicos logran modificar la creación de recuerdos (de los ratones),https://elcomercio.pe/tecnologia/actualidad/cientificos-logran-modificar-la-creacion-de-recuerdos-de-los-ratones-noticia/,"Sun, 09 Nov 2025 02:09:00 +0000",La investigación de la Escuela POlitécnica Federal de Lausana encontró que se puede controlar la expresión de la memoria con algunos cambios epigenéticos en las neuronas.,Sin categoría,El Comercio,https://elcomercio.pe/resizer/v2/AQBARQ33FJASJDSG5NBP2EFZVA.jpg?width=1200&height=800&auth=927072bf2ae6ebf0a4b6cc41f3d6faebf86e413f10ed8870d2cc52eb9dba9cae&smart=true,La investigación de la Escuela POlitécnica Federal de Lausana encontró que se puede controlar la expresión de la memoria con algunos cambios epigenéticos en las neuronas.
"Paolo Guerrero incursiona en el mundo de las barberías: “Ojalá podamos ver un Perú más seguro, donde la gente trabaje tranquila”",https://elcomercio.pe/somos/historias/paolo-guerrero-incursiona-en-el-mundo-de-las-barberias-ojala-podamos-ver-un-peru-mas-seguro-donde-la-gente-trabaje-tranquila-alianza-lima-mr-jacobs-tlcnota-noticia/,"Sun, 09 Nov 2025 02:05:46 +0000","Paolo Guerrero, el goleador histórico de la selección peruana inaugura una nueva etapa como empresario con la cadena de barberías Mr. Jacobs, pero sin dejar de lado su pasión por el fútbol, su amor por Alianza Lima y su compromiso con el país. A propósito de este proyecto, Somos conversó con él.",Sin categoría,El Comercio,https://elcomercio.pe/resizer/v2/27MACLOTQBBCTHUL7USBEDDTF4.JPG?width=4002&height=5349&auth=021fc3da567f0c5af6bf1400d5b601f77524edea7bfce4e8372427d814361efc&smart=true,"Paolo Guerrero, el goleador histórico de la selección peruana inaugura una nueva etapa como empresario con la cadena de barberías Mr. Jacobs, pero sin dejar de lado su pasión por el fútbol, su amor por Alianza Lima y su compromiso con el país. A propósito de este proyecto, Somos conversó con él."
Prime VIDEO transmitió el partido Chivas de Guadalajara 4-2 Monterrey en directo,https://elcomercio.pe/mag/usa/en-vivo-us/prime-video-en-vivo-gratis-donde-ver-partido-chivas-de-guadalajara-vs-monterrey-por-futbol-tv-y-online-nnda-nnrt-noticia/,"Sun, 09 Nov 2025 02:05:33 +0000","Chivas de Guadalajara venció a los Rayados de Monterrey y aseguró su pase a los cuartos de final de la Liguilla MX. Los tantos del Rebaño Sagrado fueron de Álvarez, González Alba, Alvarado y el Chicharito Hernández.",Sin categoría,El Comercio,https://elcomercio.pe/resizer/v2/XCT24MOFPZAG3JZNXZ2U2EJYN4.jpg?width=2400&height=1619&auth=4b85f3464a525c51dd2fbfb849e46a3813c9746d58191a766af1e2cacfffd320&smart=true,"Chivas de Guadalajara venció a los Rayados de Monterrey y aseguró su pase a los cuartos de final de la Liguilla MX. Los tantos del Rebaño Sagrado fueron de Álvarez, González Alba, Alvarado y el Chicharito Hernández."
No todos cierran en Acción de Gracias: consulta qué supermercados recibirán clientes este feriado federal,https://elcomercio.pe/mag/usa/local-us/thanksgiving-2025-los-supermercados-que-estaran-abiertos-el-dia-de-accion-de-gracias-estados-unidos-nnda-nnlt-noticia/,"Sun, 09 Nov 2025 02:05:31 +0000",¿Olvidaste comprar algo? Supermercados y tiendas que atenderán el jueves 27 de noviembre en EE.UU.,Sin categoría,El Comercio,https://elcomercio.pe/resizer/v2/PSHFJW6HK5GTVBKDBIMBVDBHIU.jpg?width=1200&height=810&auth=9234077f06283bd8214cc6ef2301dc788aeb99a99839c605060d8657e751ed32&smart=true,¿Olvidaste comprar algo? Supermercados y tiendas que atenderán el jueves 27 de noviembre en EE.UU.
"“El sonido del cajón peruano me parece reconfortante”: Rosalía nos revela los secretos de Lux, sus ganas de visitar el país y más en una entrevista desde Ciudad de México",https://elcomercio.pe/somos/historias/rosalia-lux-un-encuentro-divino-con-la-cantante-espanola-los-secretos-de-lux-el-cajon-peruano-sus-ganas-de-visitar-el-pais-y-mas-en-una-entrevista-desde-ciudad-de-mexico-tlcnota-noticia/,"Sun, 09 Nov 2025 02:04:14 +0000","Somos viajó a Ciudad de México para tener una entrevista con Rosalía, que esta semana presentó su cuarto disco de estudio, un trabajo que ya cosecha críticas positivas en todo el mundo: “Lux”. Esta es la crónica de una serie de encuentros que sostuvimos con la artista española del momento.",Sin categoría,El Comercio,https://elcomercio.pe/resizer/v2/LIG5TSSIMRCTNPS2UWHHGPDGFM.JPG?width=7430&height=3678&auth=3dc47a62faa3376761803ffd1299b8b0958cc64a3a2ba396e1fd7532e675fb90&smart=true,"Somos viajó a Ciudad de México para tener una entrevista con Rosalía, que esta semana presentó su cuarto disco de estudio, un trabajo que ya cosecha críticas positivas en todo el mundo: “Lux”. Esta es la crónica de una serie de encuentros que sostuvimos con la artista española del momento."
"Alejandro Aramburú, el peruano que brilla en la primera boy band latina de los creadores de BTS: “Los sueños se hacen realidad”",https://elcomercio.pe/somos/historias/santos-bravos-k-pop-alejandro-aramburu-el-peruano-que-brilla-en-la-primera-boy-band-latina-de-los-creadores-de-bts-los-suenos-se-hacen-realidad-bts-hybe-noticia/,"Sun, 09 Nov 2025 02:03:50 +0000","Hybe, la empresa surcoreana que lanzó al fenómeno BTS, presenta Santos Bravos, su primera ‘boy band’ de habla hispana. Con un peruano entre sus integrantes, el grupo busca conquistar la escena global con el mismo método que hizo historia en el K-pop. Conversamos con ellos en exclusiva.",Sin categoría,El Comercio,https://elcomercio.pe/resizer/v2/53TWKJM6WJHENC2ROM4VUB6SUQ.jpg?width=1200&height=1193&auth=b829ea053ae709d14b9bd8d506ec680c1e439c49160d9157723c8a8eb8f2b1e3&smart=true,"Hybe, la empresa surcoreana que lanzó al fenómeno BTS, presenta Santos Bravos, su primera ‘boy band’ de habla hispana. Con un peruano entre sus integrantes, el grupo busca conquistar la escena global con el mismo método que hizo historia en el K-pop. Conversamos con ellos en exclusiva."
"Escape al Medio Oeste: Kansas City, la joya oculta del jazz y la barbacoa que conquistó a Taylor Swift",https://elcomercio.pe/somos/historias/escape-al-medio-oeste-kansas-city-la-joya-oculta-del-jazz-y-la-barbacoa-que-conquisto-a-taylor-swift-turismo-estados-unidos-noticia/,"Sun, 09 Nov 2025 02:03:19 +0000","En la frontera entre Missouri y Kansas existe una ciudad famosa por sus fuentes de agua, su legendaria barbacoa y su pasión por el jazz. También atrae visitantes por los Kansas City Chiefs y su vínculo con la estrella pop Taylor Swift.",Sin categoría,El Comercio,https://elcomercio.pe/resizer/v2/4EGJGX7J5REB7A5ECT33VEPVRY.jpg?width=8650&height=4173&auth=33857bea56a4b8045a67c1ad23b7398898be5775fd1ba7c3d4c13bf0e28320ec&smart=true,"En la frontera entre Missouri y Kansas existe una ciudad famosa por sus fuentes de agua, su legendaria barbacoa y su pasión por el jazz. También atrae visitantes por los Kansas City Chiefs y su vínculo con la estrella pop Taylor Swift."
El cuerpo como reflejo de la mente y las emociones,https://elcomercio.pe/somos/estilo/bienestar-el-cuerpo-como-reflejo-de-la-mente-y-las-emociones-ale-llosa-estilo-de-vida-saludable-ko-noticia/,"Sun, 09 Nov 2025 02:02:48 +0000","A veces pensamos en el cuerpo como algo separado de la mente y las emociones. Como si fueran compartimentos estancos. Pero la verdad es que están profundamente conectados. Estrés, tristeza, miedo, rabia… todo se manifiesta en el cuerpo. Tensión en la mandíbula, nudos en el estómago, hombros rígidos, insomnio, enfermedades.",Sin categoría,El Comercio,https://elcomercio.pe/resizer/v2/5WI64322NRDXPALV7UXFVPX33E.jpg?width=678&height=370&auth=6d478c6b610b519a72521ab785ffb872a74d59530d781b274a4ac2ec208d4080&smart=true,"A veces pensamos en el cuerpo como algo separado de la mente y las emociones. Como si fueran compartimentos estancos. Pero la verdad es que están profundamente conectados. Estrés, tristeza, miedo, rabia… todo se manifiesta en el cuerpo. Tensión en la mandíbula, nudos en el estómago, hombros rígidos, insomnio, enfermedades."
"“Actuemos con cautela”: horóscopo, clima astral y predicciones de Somos para esta semana",https://elcomercio.pe/somos/estilo/horoscopo-de-hoy-del-8-al-14-de-noviembre-del-2025-clima-astral-y-predicciones-mercurio-retrogrado-grado-6-de-sagitario-dinero-amor-trabajo-negocios-signos-zodiaco-noticia/,"Sun, 09 Nov 2025 02:01:32 +0000","Horóscopo de hoy gratis | Clima astral | Tiempo perfecto para dejarse inspirar, meditar o simplemente dejar que lo invisible actúe a tu favor.",Sin categoría,El Comercio,https://elcomercio.pe/resizer/v2/D3ASCZVM6RFMRJZI65XLVKTM4M.jpg?width=1280&height=731&auth=72a9d680c331e10876c686cfe2b337c694f44e97dea746ad8850a295b444037c&smart=true,"Horóscopo de hoy gratis | Clima astral | Tiempo perfecto para dejarse inspirar, meditar o simplemente dejar que lo invisible actúe a tu favor."
"¿Alguien ganó el Mega Millions del 07/11/2025? Resultados, números ganadores y premio del sorteo en USA",https://elcomercio.pe/mag/usa/local-us/alguien-gano-el-mega-millions-hoy-07-de-noviembre-2025-resultados-numeros-ganadores-y-premio-del-sorteo-en-eeuu-nnda-nnrt-noticia/,"Sun, 09 Nov 2025 02:00:00 +0000","Revisa si alguien ha ganado el Mega Millions de este viernes 7 de noviembre 2025, con los resultados completos y todos los números ganadores de la noche en la lotería de Estados Unidos.",Sin categoría,El Comercio,https://elcomercio.pe/resizer/v2/ZT3VXZOWHBAVDAL32PTX6V7PNA.jpg?width=2400&height=1600&auth=17e30f828afb138a31481c18e6f59cec6df1cc6bd57e97baa0e626abb489037e&smart=true,"Revisa si alguien ha ganado el Mega Millions de este viernes 7 de noviembre 2025, con los resultados completos y todos los números ganadores de la noche en la lotería de Estados Unidos."
Sky Sports EN VIVO - cómo ver partido Real Madrid vs. Rayo Vallecano por TV y Online,https://elcomercio.pe/mag/usa/en-vivo-us/sky-sports-en-vivo-como-ver-partido-real-madrid-vs-rayo-vallecano-por-futbol-tv-y-sky-plus-online-nnda-nnse-noticia/,"Sun, 09 Nov 2025 02:00:00 +0000","Conoce cómo ver EN VIVO el partido Real Madrid vs. Rayo Vallecano por LaLiga 2025-26 en México: horarios, transmisión por Sky Sports, paquetes disponibles y opciones para verlo online.",Sin categoría,El Comercio,https://elcomercio.pe/resizer/v2/U7XRGVSDAVFSRGURC6UT5BGRBM.jpg?width=2400&height=1600&auth=228621a1df7c334b7fd054711c65609822e44e34af56a9b5f1b7b7c0bb209bf8&smart=true,"Conoce cómo ver EN VIVO el partido Real Madrid vs. Rayo Vallecano por LaLiga 2025-26 en México: horarios, transmisión por Sky Sports, paquetes disponibles y opciones para verlo online."
¡No viajarán hoy! El vuelo de la selección peruana se canceló por problemas logísticos,https://elcomercio.pe/deporte-total/seleccion/seleccion-peruana-vuelo-de-peru-se-cancelo-por-problemas-logisticos-noticia/,"Sun, 09 Nov 2025 01:58:16 +0000",La selección peruana enfrentará a Rusia y Chile en amistosos por Fecha FIFA.,Sin categoría,El Comercio,https://elcomercio.pe/resizer/v2/3GVBVN43M5F3TM363QXPPSNXSU.jpg?width=2048&height=1366&auth=cf2bc298079dafea7b4c8fec84f8dd8973f67e2f445a46ea5fce7713c5b9381a&smart=true,La selección peruana enfrentará a Rusia y Chile en amistosos por Fecha FIFA.
¿Dónde ver Chivas de Guadalajara — Rayados de Monterrey por Torneo Apertura de la Liga MX 2025?,https://elcomercio.pe/mag/usa/en-vivo-us/donde-ver-chivas-de-guadalajara-rayados-de-monterrey-en-vivo-gratis-por-apertura-2025-horarios-y-canales-tv-online-en-directo-liga-mx-nnda-nnrt-noticia/,"Sun, 09 Nov 2025 01:57:26 +0000",Chivas vs. Rayados EN VIVO GRATIS por Liga MX Apertura 2025. Consulta horarios y canales online para ver el partido en directo.,Sin categoría,El Comercio,https://elcomercio.pe/resizer/v2/IOV7SAB6W5E2NDJMWQOWDFXDBE.png?width=3600&height=2430&auth=eed0ddccd9f7c0cbf33d7efa0207c74683028a09fc6baffe2712fe36d2f68ed7&smart=true,Chivas vs. Rayados EN VIVO GRATIS por Liga MX Apertura 2025. Consulta horarios y canales online para ver el partido en directo.
¿A qué hora juega y qué canal transmite Chivas vs. Monterrey por el Torneo Apertura de Liga MX 2025?,https://elcomercio.pe/mag/usa/en-vivo-us/a-que-hora-juega-y-que-canal-transmite-chivas-de-guadalajara-vs-monterrey-en-vivo-hoy-8-de-noviembre-por-torneo-apertura-de-liga-mx-2025-usa-nnda-nnse-noticia/,"Sun, 09 Nov 2025 01:56:45 +0000",Consulta los horarios y los canales de TV para ver el partido entre Chivas de Guadalajara y Rayados de Monterrey este sábado 8 de noviembre por la Jornada 17 del Torneo Apertura de la Liga MX 2025,Sin categoría,El Comercio,https://elcomercio.pe/resizer/v2/NEGP4XOWWNEWPM2YPCRUAP7T7M.jpg?width=2400&height=1600&auth=e1b4d26379906fe402184b379c3426509f3b7114a04b7401bde62f40eb61cde4&smart=true,Consulta los horarios y los canales de TV para ver el partido entre Chivas de Guadalajara y Rayados de Monterrey este sábado 8 de noviembre por la Jornada 17 del Torneo Apertura de la Liga MX 2025
"Cruz Azul vs. Pumas hoy en vivo: hora, canal TV y dónde ver transmisión",https://elcomercio.pe/deporte-total/mexico/cruz-azul-vs-pumas-en-vivo-hoy-gratis-por-liga-mx-via-futbol-libre-tv-tudn-canal-5-vix-amazon-prime-a-que-hora-juegan-canal-de-transmision-y-donde-ver-por-torneo-apertura-video-noticia/,"Sun, 09 Nov 2025 01:54:46 +0000",Cruz Azul vs. Pumas EN VIVO: ver transmisión del partido por la fecha 17 del Torneo Apertura de la Liga MX. Entérate a qué hora juegan y en qué canales ver el partido.,Sin categoría,El Comercio,https://elcomercio.pe/resizer/v2/YNQ7D3Q2SBCFZFC7AZF7YYKZV4.jpeg?width=612&height=408&auth=273b71131e973ded3d71c816c28640a4131b029a6a8312b09e3d6dacbab75194&smart=true,Cruz Azul vs. Pumas EN VIVO: ver transmisión del partido por la fecha 17 del Torneo Apertura de la Liga MX. Entérate a qué hora juegan y en qué canales ver el partido.
"VER APPLE TV EN VIVO, Inter Miami vs. Nashville con Lionel Messi",https://elcomercio.pe/deporte-total/futbol-mundial/apple-tv-en-vivo-pelota-libre-tv-inter-miami-vs-nashville-gratis-online-via-mls-pass-futbol-libre-tv-por-playoffs-de-la-mls-con-lionel-messi-video-noticia/,"Sun, 09 Nov 2025 01:51:28 +0000",Apple TV en vivo: transmite el partido entre Inter Miami vs. Nashville por el tercer duelo de los playoffs de la MLS.,Sin categoría,El Comercio,https://elcomercio.pe/resizer/v2/GZSEAGTU3BBCFBACOIVI6GFUNA.jpg?width=1080&height=671&auth=facc3b620df34f8b28b134a3e1ed546ccea037ca9fbd21f24551c611131b0120&smart=true,Apple TV en vivo: transmite el partido entre Inter Miami vs. Nashville por el tercer duelo de los playoffs de la MLS.
Inter Miami vs. Nashville en vivo: transmisión del partido por playoffs de MLS,https://elcomercio.pe/deporte-total/futbol-mundial/inter-miami-vs-nashville-en-vivo-hoy-gratis-con-lionel-messi-por-apple-tv-mls-pass-futbol-libre-tv-a-que-hora-juegan-canal-que-pasa-y-donde-ver-por-playoffs-de-mls-video-noticia/,"Sun, 09 Nov 2025 01:51:11 +0000","Inter Miami vs. Nashville EN VIVO con Lionel Messi: ver partido por los playoffs de la MLS. Conoce los horarios, canales y dónde ver el partido por streaming.",Sin categoría,El Comercio,https://elcomercio.pe/resizer/v2/A77CUBHVQRHOREP7CXGRU6D6CU.png?width=1114&height=706&auth=23c0f58dd3520d66ff1551b99c7ce26cb1d2feaf7856c377654b19602b6c6211&smart=true,"Inter Miami vs. Nashville EN VIVO con Lionel Messi: ver partido por los playoffs de la MLS. Conoce los horarios, canales y dónde ver el partido por streaming."
Verano 2026: la tendencia de los retoques naturales y armónicos,https://elcomercio.pe/bienestar/salud-fisica/verano-2026-la-tendencia-de-los-retoques-naturales-y-armonicos-noticia/,"Sun, 09 Nov 2025 01:48:22 +0000","Se acerca el verano y las preferencias estéticas están marcadas por un concepto que viene ganando terreno: la belleza natural y armónica. Frente a los excesos del pasado, hoy hombres y mujeres priorizan procedimientos que realzan sus rasgos sin transformarlos por completo.",Sin categoría,El Comercio,https://elcomercio.pe/resizer/v2/57ZORMQIRZFKLBWHTKVXR65NBU.jpg?width=1000&height=667&auth=df5e835a31af8e2ce0d2930bd7ff7ff2069b86cf9e88e0baa8702441c2a70cbd&smart=true,"Se acerca el verano y las preferencias estéticas están marcadas por un concepto que viene ganando terreno: la belleza natural y armónica. Frente a los excesos del pasado, hoy hombres y mujeres priorizan procedimientos que realzan sus rasgos sin transformarlos por completo."
Revisa el cronograma de pagos del Banco de la Nación: Sueldos y pensiones ONP en noviembre 2025,https://elcomercio.pe/respuestas/tramites/atencion-jubilado-de-la-onp-y-sector-publico-estas-son-las-fechas-para-cobrar-sueldos-y-pensiones-en-noviembre-2025-via-banco-de-la-nacion-tdpe-noticia/,"Sun, 09 Nov 2025 01:47:00 +0000","Con el inicio de noviembre, muchos pensionistas y trabajadores del sector público esperan cobrar en el Banco de la Nación sueldos y pensiones. Revisa aquí el cronograma",Sin categoría,El Comercio,https://elcomercio.pe/resizer/v2/7UBXFJ3ICRBZJF5OASHC6HIITE.png?width=1300&height=800&auth=67f7928d8580ee98c8578f5318a9734a78f146c93240b633aa9b7f9b9b1776ca&smart=true,"Con el inicio de noviembre, muchos pensionistas y trabajadores del sector público esperan cobrar en el Banco de la Nación sueldos y pensiones. Revisa aquí el cronograma"
Los estados que sí garantizan los cupones SNAP durante el cierre de gobierno: conoce la lista completa,https://elcomercio.pe/mag/usa/local-us/los-estados-que-cubren-los-cupones-snap-en-medio-del-cierre-de-gobierno-en-estados-unidos-nnda-nnlt-noticia/,"Sun, 09 Nov 2025 00:42:46 +0000",¿Tu estado cubre los cupones SNAP este mes? Descubre dónde se activaron planes para garantizar su entrega.,Sin categoría,El Comercio,https://elcomercio.pe/resizer/v2/FKONKCKY3ZD5XJRAL76VAR7NPU.jpg?width=1200&height=810&auth=f16b3925cb8d1b14737351bc21a78bee7518803de274ecb8c9a4970c74169e46&smart=true,¿Tu estado cubre los cupones SNAP este mes? Descubre dónde se activaron planes para garantizar su entrega.
"Powerball hoy, EN VIVO ONLINE: sigue aquí el sorteo del sábado 8 de noviembre",https://elcomercio.pe/respuestas/usa/powerball-online-en-vivo-hoy-resultados-del-sabado-8-de-noviembre-de-2025-winning-numbers-mega-millions-cash-value-double-play-washington-eeuu-usa-lbposting-noticia/,"Sun, 09 Nov 2025 01:40:51 +0000",Powerball EN VIVO ONLINE del sábado 8 de noviembre del 2025: revisa aquí los resultados de la lotería más popular de Estados Unidos. También sigue el sorteo y los números ganadores del Double Play.,Sin categoría,El Comercio,https://elcomercio.pe/resizer/v2/2XLTV7SEH5BIVL2RYQ4FK4ABTY.jpg?width=1200&height=700&auth=2ee764e1a8809ece31ccf445e522bec1e57ce350299d9a4e585c9a1b993d48cb&smart=true,Powerball EN VIVO ONLINE del sábado 8 de noviembre del 2025: revisa aquí los resultados de la lotería más popular de Estados Unidos. También sigue el sorteo y los números ganadores del Double Play.
Resultados de Loto Plus 3829 : revisa aquí los números y sorteo del sábado 8 de noviembre,https://elcomercio.pe/respuestas/argentina/loto-plus-en-vivo-resultados-hoy-sabado-8-de-noviembre-de-2025-numeros-ganadores-y-premios-del-sorteo-3829-loteria-de-argentina-tradicional-match-desquite-sale-o-sale-lbposting-ar-noticia/,"Sun, 09 Nov 2025 01:30:42 +0000","Loto Plus EN VIVO: mira los resultados y números del sorteo del sábado 8 de noviembre, que tiene un pozo de $22.290.000.000.",Sin categoría,El Comercio,https://elcomercio.pe/resizer/v2/NE2Q6RKC7ZCJLPQIHXMKB3TNUM.jpg?width=1200&height=700&auth=ebdd2c7f09b358ceaefa94d5d692d527e326cecc08d309a548b4bf37e71516ab&smart=true,"Loto Plus EN VIVO: mira los resultados y números del sorteo del sábado 8 de noviembre, que tiene un pozo de $22.290.000.000."
"Boca — River EN VIVO GRATIS — hora, TV, formaciones y dónde ver ONLINE por Superclásico Argentino 2025",https://elcomercio.pe/mag/usa/en-vivo-us/boca-river-en-vivo-gratis-hora-tv-formaciones-y-donde-ver-online-por-superclasico-argentino-2025-nnda-nnrt-noticia/,"Sun, 09 Nov 2025 01:30:00 +0000","Superclásico Argentino 2025: Boca vs. River EN VIVO GRATIS. Consulta hora, TV, formaciones y dónde ver ONLINE el partido de fútbol hoy.",Sin categoría,El Comercio,https://elcomercio.pe/resizer/v2/OBKO6U2NSZA6RMCXENQQPPPAH4.png?width=3600&height=2430&auth=553faba95e8fba521871a2b4a9d899330bd2aadd188402597912148841b02eba&smart=true,"Superclásico Argentino 2025: Boca vs. River EN VIVO GRATIS. Consulta hora, TV, formaciones y dónde ver ONLINE el partido de fútbol hoy."
Resultados de la Lotería Nacional de Panamá del domingo 9 de noviembre: cómo ver el sorteo,https://elcomercio.pe/respuestas/loteria-nacional-de-panama-en-vivo-hoy-del-domingo-9-de-noviembre-de-2025-resultados-del-sorteo-dominical-numeros-ganadores-chances-premios-lnbpma-pa-lbposting-noticia/,"Sun, 09 Nov 2025 01:30:00 +0000",Lotería Nacional de Panamá EN VIVO domingo 9 de noviembre: Conoce los resultados y números ganadores del sorteo dominical de la Lotería Nacional de Beneficencia de Panamá y descubre si eres uno de los ganadores.,Sin categoría,El Comercio,https://elcomercio.pe/resizer/v2/3GSUV6YBI5GLLPDT5A4B2PRLAY.jpg?width=1200&height=700&auth=b22b75c9005f90aa7e8386e1373bccb63613873fbabb77ac43d8e79ae0b59c32&smart=true,Lotería Nacional de Panamá EN VIVO domingo 9 de noviembre: Conoce los resultados y números ganadores del sorteo dominical de la Lotería Nacional de Beneficencia de Panamá y descubre si eres uno de los ganadores.
La Kábala EN VIVO hoy sábado 8 de noviembre: cuál es el pozo acumulado del sorteo,https://elcomercio.pe/respuestas/loterias/kabala-en-vivo-resultados-hoy-sabado-8-de-novimebre-de-2025-numeros-y-jugada-ganadora-pozo-buenazo-la-tinka-chau-chamba-intralot-tinkanet-loteria-lbposting-noticia/,"Sun, 09 Nov 2025 01:29:56 +0000","Kábala EN VIVO: Conoce aquí los resultados de La Kábala del jueves 6 de noviembre, que tiene un pozo acumulado de S/ 3'691,733. Además, puedes seguir el sorteo de Chau Chamba.",Sin categoría,El Comercio,https://elcomercio.pe/resizer/v2/7KQZ6YX7DJBNNGKKCWE6SSWG4U.jpg?width=1200&height=700&auth=6032e98007517db635f9ebaee93176737c3dc2a97b24340a342909ece36275f0&smart=true,"Kábala EN VIVO: Conoce aquí los resultados de La Kábala del jueves 6 de noviembre, que tiene un pozo acumulado de S/ 3'691,733. Además, puedes seguir el sorteo de Chau Chamba."
"Temblor en Colombia HOY, sábado 8 de noviembre: sismos recientes reportados por el SGC",https://elcomercio.pe/respuestas/colombia/temblor-en-colombia-hoy-en-vivo-ultimo-sismo-8-y-9-de-noviembre-2025-reporte-de-magnitud-epicentro-y-hora-segun-sgc-servicio-geologico-colombiano-santander-co-lbposting-noticia/,"Sun, 09 Nov 2025 01:28:09 +0000",Temblor en Colombia EN VIVO: cuál fue el epicentro y magnitud del último sismo reportado HOY por el Servicio Geológico Colombiano (SGC).,Sin categoría,El Comercio,https://elcomercio.pe/resizer/v2/LZIY5BG53BDKZFAUQM3FJRQC64.png?width=1200&height=700&auth=d74571361c28ae07b492884615de02f375468c084bbdc20838a1100d5f910c78&smart=true,Temblor en Colombia EN VIVO: cuál fue el epicentro y magnitud del último sismo reportado HOY por el Servicio Geológico Colombiano (SGC).
"Temblor en México hoy, sábado 8 de noviembre: sismos recientes reportados por el SSN",https://elcomercio.pe/respuestas/mexico/temblor-en-mexico-hoy-ultimos-sismos-de-noviembre-en-vivo-cual-fue-el-epicentro-y-magnitud-segun-reporte-del-ssn-servicio-sismologico-nacional-mexico-cdmx-mx-lbposting-noticia/,"Sun, 09 Nov 2025 01:28:05 +0000",Temblor en México EN VIVO: cuál fue el epicentro y magnitud del último evento sísmico reportado HOY por el Servicio Sismológico Nacional (SSN).,Sin categoría,El Comercio,https://elcomercio.pe/resizer/v2/5W5APQLFWZDCTI7JWM3OVXBQ2Q.jpg?width=1200&height=700&auth=f5964a0285f08e1783ec138bd3e1bd5668b5c5b8eabb4c12f3b981663819a970&smart=true,Temblor en México EN VIVO: cuál fue el epicentro y magnitud del último evento sísmico reportado HOY por el Servicio Sismológico Nacional (SSN).
📺 Canales TV para ver Toluca vs. Club América EN VIVO GRATIS por Torneo Apertura de la Liga MX,https://elcomercio.pe/mag/usa/en-vivo-us/a-que-hora-juega-y-que-canal-transmite-toluca-vs-america-en-vivo-hoy-8-de-noviembre-por-torneo-apertura-de-liga-mx-2025-usa-nnda-nnse-noticia/,"Sun, 09 Nov 2025 01:24:35 +0000",Consulta los canales de TV y plataformas online para ver el partido Toluca vs. América en vivo y en directo hoy por la Jornada 17 del Torneo Apertura de la Liga MX 2025.,Sin categoría,El Comercio,https://elcomercio.pe/resizer/v2/NXL53OCWDRHBPJG5BDKSO37IWY.jpg?width=2400&height=1620&auth=c882aefcc0c97f7f8da32cc9ab7a4105e9c16a1db10012a50ed9d426836c8fff&smart=true,Consulta los canales de TV y plataformas online para ver el partido Toluca vs. América en vivo y en directo hoy por la Jornada 17 del Torneo Apertura de la Liga MX 2025.
🏟️ VER Canal 5 (TUDN) EN VIVO | Transmisión del América-Toluca EN DIRECTO por TV abierta,https://elcomercio.pe/mag/usa/en-vivo-us/canal-5-y-tudn-en-vivo-gratis-como-ver-partido-club-america-vs-toluca-por-tv-abierta-y-futbol-online-vix-premium-nnda-nnrt-noticia/,"Sun, 09 Nov 2025 01:24:02 +0000",Transmisión oficial vía Canal 5 y TUDN EN VIVO EN DIRECTO para ver el partido Club América vs. Toluca hoy por la jornada 17 del Torneo Apertura de la Liga MX desde el Estadio Nemesio Diez de Edomex.,Sin categoría,El Comercio,https://elcomercio.pe/resizer/v2/2UZUOTLJ7FD5TNGQSLKN5PBNI4.jpg?width=2400&height=1620&auth=91441aea5df36b0205989fe0031aa52fa5c015ba0695e447e956ded222247f62&smart=true,Transmisión oficial vía Canal 5 y TUDN EN VIVO EN DIRECTO para ver el partido Club América vs. Toluca hoy por la jornada 17 del Torneo Apertura de la Liga MX desde el Estadio Nemesio Diez de Edomex.
