titulo,enlace,fecha,descripcion,categoria,fuente,imagen,contenido
Sporting Cristal vs. Cienciano EN VIVO vía L1 Max: ¿a qué hora y dónde ver la fecha 18 del Torneo Clausura 2025?,https://rpp.pe/futbol/descentralizado/sporting-cristal-vs-cienciano-en-vivo-a-que-hora-juegan-y-donde-ver-por-tv-fecha-18-torneo-clausura-2025-via-l1-max-online-partidos-de-hoy-noticia-1662703,"Fri, 07 Nov 2025 16:55:28 -0500",Sporting Cristal juega de local contra Cienciano en el Estadio Alberto Gallardo. Conoce a qué hora juegan y dónde ver el partido EN VIVO.,Sin categoría,RPP,https://f.rpp-noticias.io/2025/11/06/301630_1809564.jpg?imgdimension=look,Sporting Cristal juega de local contra Cienciano en el Estadio Alberto Gallardo. Conoce a qué hora juegan y dónde ver el partido EN VIVO.
"Liga 1: Con doblete de Facundo Callejo, Cusco FC liquidó 3-0 a Sport Boys",https://rpp.pe/futbol/descentralizado/liga-1-por-la-fecha-18-se-enfrentaran-cusco-fc-y-sport-boys-noticia-1662633,"Fri, 07 Nov 2025 16:50:11 -0500",Cusco FC vs Sport Boys se enfrentaron por la Perú - Primera División. Aquí todos los detalles y resumen del encuentro.,Sin categoría,RPP,https://f.rpp-noticias.io/2025/11/07/1810082.jpg?imgdimension=look,Cusco FC vs Sport Boys se enfrentaron por la Perú - Primera División. Aquí todos los detalles y resumen del encuentro.
Sport Huancayo vs. Estudiantil CNI: ¿a qué hora juegan y y dónde ver EN VIVO la final vuelta de la Liga3?,https://rpp.pe/futbol/mas-futbol/sport-huancayo-vs-estudiantil-cni-en-vivo-a-que-hora-juegan-y-donde-ver-final-vuelta-liga-3-via-youtube-fpf-partidos-de-hoy-noticia-1662908,"Fri, 07 Nov 2025 16:50:59 -0500",Revisa los detalles del partido entre Sport Huancayo y Estudiantil CNI por la final de la Liga3. El campeón logrará el ascenso a la Liga2 del 2026.,Sin categoría,RPP,https://f.rpp-noticias.io/2025/11/07/021202_1810071.jpg?imgdimension=look,Revisa los detalles del partido entre Sport Huancayo y Estudiantil CNI por la final de la Liga3. El campeón logrará el ascenso a la Liga2 del 2026.
"Serie A: Con gol de Idrissa Touré, Pisa le ganó a Cremonese por 1 a 0",https://rpp.pe/futbol/ligas-internacionales/serie-a-pisa-recibira-a-cremonese-por-la-fecha-11-noticia-1662652,"Fri, 07 Nov 2025 16:45:12 -0500",Pisa vs Cremonese se enfrentaron por la Italia - Serie A. Aquí todos los detalles y resumen del encuentro.,Sin categoría,RPP,https://f.rpp-noticias.io/2025/11/07/1810081.jpg?imgdimension=look,Pisa vs Cremonese se enfrentaron por la Italia - Serie A. Aquí todos los detalles y resumen del encuentro.
Liga de Francia: Solitario gol le da triunfo 1-0 a Stade Rennes sobre Paris FC,https://rpp.pe/futbol/ligas-internacionales/liga-de-francia-por-la-fecha-12-paris-fc-recibira-a-stade-rennes-noticia-1662653,"Fri, 07 Nov 2025 16:45:12 -0500",Paris FC vs Stade Rennes se enfrentaron por la Francia - Primera División. Aquí todos los detalles y resumen del encuentro.,Sin categoría,RPP,https://f.rpp-noticias.io/2025/11/07/1810080.jpg?imgdimension=look,Paris FC vs Stade Rennes se enfrentaron por la Francia - Primera División. Aquí todos los detalles y resumen del encuentro.
El pago de CTS de noviembre 2025 se acerca: ¿Cómo calcular el monto que te depositarán y hasta cuándo retirar?,https://rpp.pe/economia/economia/cts-de-noviembre-2025-como-calcular-el-monto-que-deben-depositarte-y-hasta-cuando-podras-retirar-tu-dinero-noticia-1661355,"Fri, 07 Nov 2025 16:15:40 -0500","El Gobierno autorizó el retiro del 100 % de la CTS hasta diciembre de 2026, permitiendo a los trabajadores formales disponer libremente de sus fondos en una o varias operaciones. La medida tiene como fin brindar liquidez ante la coyuntura económica y rige para todos los depósitos acumulados en el sistema financiero.",Sin categoría,RPP,https://f.rpp-noticias.io/2025/11/05/063506_1809160.jpg?imgdimension=look,"El Gobierno autorizó el retiro del 100 % de la CTS hasta diciembre de 2026, permitiendo a los trabajadores formales disponer libremente de sus fondos en una o varias operaciones. La medida tiene como fin brindar liquidez ante la coyuntura económica y rige para todos los depósitos acumulados en el sistema financiero."
Cúal fue el último temblor en México hoy 7 de noviembre según SSN,https://rpp.pe/mundo/mexico/cual-fue-el-ultimo-temblor-en-mexico-hoy-6-de-noviembre-segun-ssn-live-3034,"Thu, 06 Nov 2025 06:27:35 -0500",Cuál es el ultimo temblor en México y CDMX registrado segun el Servicio Sismológico Nacional (SSN) hoy 7 de noviembre del 2025. Consulta los últimos sismos EN VIVO para México aquí.,Sin categoría,RPP,https://f.rpp-noticias.io/2024/11/07/111411_1666676.jpg?imgdimension=look,Cuál es el ultimo temblor en México y CDMX registrado segun el Servicio Sismológico Nacional (SSN) hoy 7 de noviembre del 2025. Consulta los últimos sismos EN VIVO para México aquí.
Fabio Gruber: los destacados números del convocado por la Selección Peruana tras triunfo del Núremberg,https://rpp.pe/futbol/peruanos-en-el-mundo/fabio-gruber-los-destacados-numeros-del-convocado-por-seleccion-peruana-en-triunfo-nuremberg-vs-dynamo-dresden-noticia-1662901,"Fri, 07 Nov 2025 16:44:55 -0500","Con Fabio Gruber, Núremberg venció 2-1 a Dynamo Dresden y se ubica en el noveno lugar de la Bundesliga II.",Sin categoría,RPP,https://f.rpp-noticias.io/2025/11/07/592459_1810077.jpg?imgdimension=look,"Con Fabio Gruber, Núremberg venció 2-1 a Dynamo Dresden y se ubica en el noveno lugar de la Bundesliga II."
"Jennifer Lawrence revela que ""tiene una vida secreta"" en TikTok para pelearse con desconocidos",https://rpp.pe/famosos/celebridades/jennifer-lawrence-revela-que-tiene-una-vida-secreta-en-tiktok-para-pelearse-robert-pattinson-noticia-1662891,"Fri, 07 Nov 2025 16:42:09 -0500","En una entrevista con Robert Pattinson, la actriz Jennifer Lawrence contó que viene usando TikTok de manera anónima. ""Me peleo en la sección de comentarios"", expresó.",Sin categoría,RPP,https://f.rpp-noticias.io/2025/11/07/545254_1810039.jpg?imgdimension=look,"En una entrevista con Robert Pattinson, la actriz Jennifer Lawrence contó que viene usando TikTok de manera anónima. ""Me peleo en la sección de comentarios"", expresó."
Jorge Luis Salinas deslumbra a Donatella Versace con su colección artesanal en los Latin American Fashion Awards 2025,https://rpp.pe/famosos/celebridades/jorge-luis-salinas-deslumbra-a-donatella-versace-con-su-coleccion-artesanal-en-los-latin-american-fashion-awards-2025-noticia-1662904,"Fri, 07 Nov 2025 16:32:17 -0500","Donatella Versace y los miembros del jurado quedaron fascinados con la colección del diseñador, que representa la calidad del trabajo hecho a mano en el Perú. Salinas es finalista y espera ganar el primer puesto.",Sin categoría,RPP,https://f.rpp-noticias.io/2025/11/07/245424_1810064.jpg?imgdimension=look,"Donatella Versace y los miembros del jurado quedaron fascinados con la colección del diseñador, que representa la calidad del trabajo hecho a mano en el Perú. Salinas es finalista y espera ganar el primer puesto."
Al volante con RPP te premia: estos son los ganadores,https://rpp.pe/campanas/concurso/al-volante-con-rpp-estos-son-los-premios-y-ganadores-noticia-1662906,"Fri, 07 Nov 2025 16:39:56 -0500",Conoce a los afortunados de la comunidad de 'Al volante con RPP' que se llevaron increíbles premios.,Sin categoría,RPP,https://f.rpp-noticias.io/2025/11/07/565756_1810067.jpg?imgdimension=look,Conoce a los afortunados de la comunidad de 'Al volante con RPP' que se llevaron increíbles premios.
"Rusia advierte de nuevo a EE.UU. contra cualquier agresión a Venezuela: ""Agravará la situación en lugar de resolver los problemas""",https://rpp.pe/mundo/actualidad/rusia-advierte-de-nuevo-a-eeuu-contra-cualquier-agresion-a-venezuela-agravara-la-situacion-en-lugar-de-resolver-los-problemas-noticia-1662911,"Fri, 07 Nov 2025 16:34:09 -0500","El Gobierno advirtió que una intervención militar de Estados Unidos en Venezuela solo agravaría las tensiones, llamando a resolver las diferencias por la vía diplomática.",Sin categoría,RPP,https://f.rpp-noticias.io/2025/11/07/221922_1810075.jpg?imgdimension=look,"El Gobierno advirtió que una intervención militar de Estados Unidos en Venezuela solo agravaría las tensiones, llamando a resolver las diferencias por la vía diplomática."
Tabla de posiciones de Liga 1 Te Apuesto 2025 EN VIVO: así está el Acumulado y el Clausura en la fecha 18,https://rpp.pe/futbol/descentralizado/tabla-acumulada-liga-1-y-torneo-clausura-2025-en-vivo-resultados-y-posiciones-tras-partidos-de-hoy-universitario-alianza-lima-sporting-cristal-noticia-1647030,"Fri, 07 Nov 2025 16:30:26 -0500","Sigue el movimiento de las posiciones y cómo va la Tabla Acumulada de la Liga1 Te Apuesto 2025. Se definen los playoffs, los cupos internacionales y el descenso.",Sin categoría,RPP,https://f.rpp-noticias.io/2025/07/18/503150_1771847.jpg?imgdimension=look,"Sigue el movimiento de las posiciones y cómo va la Tabla Acumulada de la Liga1 Te Apuesto 2025. Se definen los playoffs, los cupos internacionales y el descenso."
Sigue el Universitario vs. Deportivo Garcilaso EN VIVO: juegan en el Monumental por la fecha 18 del Clausura 2025 de Liga1,https://rpp.pe/futbol/descentralizado/universitario-vs-garcilaso-en-vivo-ver-gol-peru-transmision-directo-fecha-18-torneo-clausura-2025-link-gratis-festejo-del-tri-partidos-de-hoy-noticia-1662669,"Fri, 07 Nov 2025 16:30:57 -0500",Universitario recibe a Garcilaso en su primer partido como tricampeón de la Liga1 Te Apuesto. Sigue el minuto a minuto del partido en la fecha 18 del Torneo Clausura.,Sin categoría,RPP,https://f.rpp-noticias.io/2025/11/06/241324_1809467.jpg?imgdimension=look,Universitario recibe a Garcilaso en su primer partido como tricampeón de la Liga1 Te Apuesto. Sigue el minuto a minuto del partido en la fecha 18 del Torneo Clausura.
"Partidos de hoy, viernes 7 de noviembre del 2025: horarios y canales TV para ver EN VIVO Liga1 y LaLiga",https://rpp.pe/futbol/descentralizado/partidos-de-hoy-viernes-7-de-noviembre-del-2025-horarios-y-canales-tv-para-ver-en-vivo-liga1-y-laliga-noticia-1662707,"Fri, 07 Nov 2025 16:30:51 -0500","Fútbol EN VIVO | Horarios y canales de TV para ver EN DIRECTO los partidos de hoy, viernes 7 de noviembre del 2025.",Sin categoría,RPP,https://f.rpp-noticias.io/2025/11/06/145214_1809584.jpg?imgdimension=look,"Fútbol EN VIVO | Horarios y canales de TV para ver EN DIRECTO los partidos de hoy, viernes 7 de noviembre del 2025."
Arequipa: delincuentes piden cinco mil soles para entregar miniván robada,https://rpp.pe/rotafono/seguridad-ciudadana/arequipa-delincuentes-piden-cinco-mil-soles-para-entregar-minivan-robada-noticia-1662910,"Fri, 07 Nov 2025 16:15:53 -0500",Rotafono de RPP | Padre de familia denuncia ser víctima de extorsión y pide que la PNP identifique y capture a los hampones que con engaños le sustrajeron su vehículo en el distrito arequipeño de Cayma.,Sin categoría,RPP,https://f.rpp-noticias.io/2025/11/07/321032_1810070.jpg?imgdimension=look,Rotafono de RPP | Padre de familia denuncia ser víctima de extorsión y pide que la PNP identifique y capture a los hampones que con engaños le sustrajeron su vehículo en el distrito arequipeño de Cayma.
Donatella Versace queda impactada con la colección de Jorge Luis Salinas en el Latin American Fashion Awards 2025,https://rpp.pe/videos/entretenimiento/donatella-versace-queda-impactada-con-la-coleccion-de-jorge-luis-salinas-en-el-latin-american-fashion-awards-2025-noticia-1662912,"Fri, 07 Nov 2025 15:46:28 -0500","Donatella Versace y los miembros del jurado quedaron fascinados con la colección del diseñador, que representa la calidad del trabajo hecho a mano en el Perú.",Sin categoría,RPP,,"Donatella Versace y los miembros del jurado quedaron fascinados con la colección del diseñador, que representa la calidad del trabajo hecho a mano en el Perú."
Estrenos de Películas hoy 07 de noviembre del 2025,https://rpp.pe/cine/cartelera/estrenos-de-peliculas-hoy-06-de-noviembre-del-2025-noticia-1662618,"Thu, 06 Nov 2025 07:02:04 -0500","Estas son las películas que se estrenan hoy en Perú en las plataformas online de streaming. Revisa aquí la sinopsis, puntaje y trailer de los títulos de Netflix, Amazon Prime, Disney y Max.",Sin categoría,RPP,,"Estas son las películas que se estrenan hoy en Perú en las plataformas online de streaming. Revisa aquí la sinopsis, puntaje y trailer de los títulos de Netflix, Amazon Prime, Disney y Max."
Corte de agua en Lima hoy 07 de noviembre: Distritos y horarios afectados,https://rpp.pe/lima/obras/corte-de-agua-en-lima-hoy-07-de-noviembre-distritos-y-horarios-afectados-noticia-1662790,"Fri, 07 Nov 2025 05:00:38 -0500",EN VIVO Consulta aquí los distritos de Lima y horarios afectados por el corte de agua programado por el Servicio de Agua Potable y Alcantarillado de Lima (Sedapal) para hoy.,Sin categoría,RPP,https://f.rpp-noticias.io/2025/03/06/022702_1714109.jpg?imgdimension=look,EN VIVO Consulta aquí los distritos de Lima y horarios afectados por el corte de agua programado por el Servicio de Agua Potable y Alcantarillado de Lima (Sedapal) para hoy.
Plazo para el pago de la CTS ya venció: ¿Qué debes hacer en caso no te hayan depositado?,https://rpp.pe/economia/economia/cts-2025-se-paga-hasta-hoy-que-hacer-si-no-te-depositan-y-que-multas-pueden-recibir-empresas-noticia-1634797,"Tue, 27 May 2025 11:00:44 -0500",Las empresas que no hayan cumplido con el depósito de la CTS en el plazo establecido incurrirán en una infracción grave que es sancionada por la Superintendencia Nacional de Fiscalización Laboral (Sunafil).,Sin categoría,RPP,https://f.rpp-noticias.io/2025/05/15/343934_1744213.jpg?imgdimension=look,Las empresas que no hayan cumplido con el depósito de la CTS en el plazo establecido incurrirán en una infracción grave que es sancionada por la Superintendencia Nacional de Fiscalización Laboral (Sunafil).
"Retiro de CTS: desde el 2027 podrás disponer del 50 % de tus fondos, ¿en qué consiste?",https://rpp.pe/economia/economia/retiro-de-cts-desde-2027-se-podra-disponer-del-50-del-fondo-en-que-consiste-noticia-1634147,"Tue, 27 May 2025 10:15:09 -0500",El reciente cuarto retiro de la CTS en Perú permite el acceso inmediato a estos fondos mientras se espera el reglamento oficial. Jorge Carillo Acosta analiza los cambios del fondo para el 2027.,Sin categoría,RPP,https://f.rpp-noticias.io/2025/05/12/241924_1742937.jpg?imgdimension=look,El reciente cuarto retiro de la CTS en Perú permite el acceso inmediato a estos fondos mientras se espera el reglamento oficial. Jorge Carillo Acosta analiza los cambios del fondo para el 2027.
Boca Juniors vs. River Plate: ¿a qué hora juegan y dónde ver EN VIVO el Superclásico 2025 en La Bombonera?,https://rpp.pe/futbol/futbol-mundial/boca-vs-river-en-vivo-a-que-hora-juegan-y-donde-ver-superclasico-del-torneo-clausura-2025-argentina-via-espn-premium-gratis-partidos-de-hoy-noticia-1662890,"Fri, 07 Nov 2025 15:52:19 -0500","Revisa los detalles del Superclásico por el Torneo Clausura del fútbol argentino, con la visita de River Plate al campo de Boca Juniors.",Sin categoría,RPP,https://f.rpp-noticias.io/2025/11/07/005400_1810040.jpg?imgdimension=look,"Revisa los detalles del Superclásico por el Torneo Clausura del fútbol argentino, con la visita de River Plate al campo de Boca Juniors."
Retiro CTS 2025: ¿Cuántas veces podrás disponer del 100 % de los fondos?,https://rpp.pe/economia/economia/retiro-cts-2025-desde-cuando-y-cuantas-veces-podras-sacar-el-100-del-dinero-de-tus-fondos-noticia-1633646,"Fri, 07 Nov 2025 15:30:15 -0500","La norma establece que los trabajadores podrán disponer libremente del total de sus depósitos acumulados en entidades financieras, en una sola operación o en varias, hasta el 31 de diciembre de 2026.",Sin categoría,RPP,https://f.rpp-noticias.io/2025/05/15/275227_1744289.jpg?imgdimension=look,"La norma establece que los trabajadores podrán disponer libremente del total de sus depósitos acumulados en entidades financieras, en una sola operación o en varias, hasta el 31 de diciembre de 2026."
"Rospigliosi dice al JEE Pacasmayo que ""no hay evidencia"" que lo vincule a presunto uso irregular de cámara del Congreso",https://rpp.pe/politica/congreso/rospigliosi-dice-que-no-hay-evidencia-que-lo-vincule-a-presunto-uso-irregular-de-camara-del-congreso-noticia-1662880,"Fri, 07 Nov 2025 15:45:14 -0500","Por su parte, Giovanni Forno, Oficial Mayor del Congreso, indicó al coordinador del JEE Pacasmayo que, el día en que se realizaron los hechos investigados, él se encontraba ""ejerciendo su descanso vacacional"".",Sin categoría,RPP,https://f.rpp-noticias.io/2025/11/07/1810041imagen-4webp.jpg?imgdimension=look,"Por su parte, Giovanni Forno, Oficial Mayor del Congreso, indicó al coordinador del JEE Pacasmayo que, el día en que se realizaron los hechos investigados, él se encontraba ""ejerciendo su descanso vacacional""."
Retiro del 100 % de la CTS: el 2 de abril se debatirá el proyecto de ley en la Comisión de Economía [VIDEO],https://rpp.pe/economia/economia/retiro-del-100-de-la-cts-el-2-de-abril-se-debatira-el-proyecto-de-ley-en-la-comision-de-economia-noticia-1623028,"Wed, 19 Mar 2025 19:45:38 -0500","La Comisión de Trabajo aprobó un proyecto de ley que propone el retiro del 100 % de la CTS. Ilich López, presidente de la Comisión de Economía, dio a conocer cuál es el proceso que seguirán para analizar si el dictamen llega o no al Pleno del Congreso.",Sin categoría,RPP,,"La Comisión de Trabajo aprobó un proyecto de ley que propone el retiro del 100 % de la CTS. Ilich López, presidente de la Comisión de Economía, dio a conocer cuál es el proceso que seguirán para analizar si el dictamen llega o no al Pleno del Congreso."
MEF alista primer paquete de shock desregulatorio para el mes de julio,https://rpp.pe/economia/economia/mef-alista-primer-paquete-de-shock-desregulatorio-para-el-mes-de-julio-noticia-1618591,"Thu, 27 Feb 2025 18:15:32 -0500","Titular del MEF expresó su compromiso para apoyar medidas que establezcan candados para evitar afectar el ahorro interno, tales como el retiro de fondos de las AFP y de los depósitos CTS.",Sin categoría,RPP,https://f.rpp-noticias.io/2025/02/26/024002_1710679.jpg?imgdimension=look,"Titular del MEF expresó su compromiso para apoyar medidas que establezcan candados para evitar afectar el ahorro interno, tales como el retiro de fondos de las AFP y de los depósitos CTS."
"Fepcmac sobre posible retiro del 100 % de la CTS: ""Lo repudiamos. Es pan para hoy y miseria para mañana""",https://rpp.pe/economia/economia/fepcmac-sobre-posible-retiro-del-100-de-la-cts-la-repudiamos-es-pan-para-hoy-y-miseria-para-manana-noticia-1612646,"Tue, 28 Jan 2025 14:00:32 -0500","Jorge Solís, presidente de la Fepcmac, expresó su rechazo ante los 9 proyectos de ley que se han presentado en el Congreso para retirar el 100 % de la CTS, ya que desvían el objetivo real de este fondo.",Sin categoría,RPP,https://f.rpp-noticias.io/2025/01/28/410341_1698048.jpg?imgdimension=look,"Jorge Solís, presidente de la Fepcmac, expresó su rechazo ante los 9 proyectos de ley que se han presentado en el Congreso para retirar el 100 % de la CTS, ya que desvían el objetivo real de este fondo."
Retiro de la CTS: ¿Qué falta tras la firma del presidente del Congreso y cuándo podrías acceder al dinero?,https://rpp.pe/economia/economia/retiro-de-la-cts-presidente-del-congreso-firmo-autografa-de-ley-que-autoriza-la-medida-noticia-1631389,"Tue, 29 Apr 2025 10:45:40 -0500","Eduardo Salhuana, presidente del Congreso, firmó la autógrafa de ley que dispone el nuevo retiro de la CTS hasta diciembre de 2026. Como se recuerda, esta iniciativa legislativa fue aprobada en el Pleno del Congreso el miércoles 16 de abril con 97 votos a favor, seis votos en contra y una abstención",Sin categoría,RPP,,"Eduardo Salhuana, presidente del Congreso, firmó la autógrafa de ley que dispone el nuevo retiro de la CTS hasta diciembre de 2026. Como se recuerda, esta iniciativa legislativa fue aprobada en el Pleno del Congreso el miércoles 16 de abril con 97 votos a favor, seis votos en contra y una abstención"
El Ejecutivo promulgó la ley que permite el retiro del 100 % de la CTS hasta diciembre del 2026,https://rpp.pe/politica/gobierno/cts-ejecutivo-promulgo-ley-que-permite-retiro-del-100-hasta-diciembre-del-2026-noticia-1633533,"Fri, 09 May 2025 15:00:49 -0500","La norma fue publicada este viernes en el diario oficial El Peruano y establece, además, que los trabajadores, en caso sean diagnosticados ""con enfermedad terminal o cáncer"", podrán retirar el 100 % de la CTS ""en cualquier momento"".",Sin categoría,RPP,https://f.rpp-noticias.io/2025/05/09/501250_1741519.jpg?imgdimension=look,"La norma fue publicada este viernes en el diario oficial El Peruano y establece, además, que los trabajadores, en caso sean diagnosticados ""con enfermedad terminal o cáncer"", podrán retirar el 100 % de la CTS ""en cualquier momento""."
Se aprobó retiro del 100 % de la CTS: ¿Es un fondo para enfrentar crisis económicas o un seguro contra el desempleo? Esto dicen los expertos [INFORME],https://rpp.pe/economia/economia/es-la-cts-un-fondo-para-enfrentar-crisis-economica-o-un-seguro-contra-el-desempleo-esto-dicen-los-expertos-noticia-1611507,"Fri, 09 May 2025 08:15:09 -0500","El Pleno del Congreso aprobó el texto sustitutorio de la ley que modifica el decreto legislativo 650 y que faculta el retiro de hasta el 100 % de la CTS. Con ello, ahora los trabajadores podrán retirar sus aportes, pero por una sola ocasión, con plazo hasta diciembre del 2026.",Sin categoría,RPP,https://f.rpp-noticias.io/2025/01/22/370037_1695561.jpg?imgdimension=look,"El Pleno del Congreso aprobó el texto sustitutorio de la ley que modifica el decreto legislativo 650 y que faculta el retiro de hasta el 100 % de la CTS. Con ello, ahora los trabajadores podrán retirar sus aportes, pero por una sola ocasión, con plazo hasta diciembre del 2026."
CTS se encuentra habilitada en bancos: revisa AQUÍ toda la lista,https://rpp.pe/economia/economia/cts-ya-esta-disponible-en-algunos-bancos-pese-a-falta-de-reglamento-del-mtpe-noticia-1633818,"Tue, 20 May 2025 12:00:24 -0500","Aunque el Ejecutivo estableció que primero se debía reglamentar la norma que faculta el retiro de la CTS, diferentes bancos sí permiten que sus usuarios retiren los fondos.",Sin categoría,RPP,https://f.rpp-noticias.io/2025/05/20/491249_1746334.jpg?imgdimension=look,"Aunque el Ejecutivo estableció que primero se debía reglamentar la norma que faculta el retiro de la CTS, diferentes bancos sí permiten que sus usuarios retiren los fondos."
Universitario vs Panta Walon EN VIVO: ¿a qué hora juegan y dónde ver la gran final del Futsal Pro 2025?,https://rpp.pe/futbol/mas-futbol/universitario-vs-panta-walon-en-vivo-a-que-hora-juegan-y-donde-ver-final-liga-futsal-pro-2025-via-youtube-dyj-sports-link-gratis-partidos-de-hoy-noticia-1662902,"Fri, 07 Nov 2025 15:40:45 -0500",Universitario vs Panta Walon EN VIVO: sigue la transmisión del encuentro por la gran final del Futsal Pro 2025.,Sin categoría,RPP,https://f.rpp-noticias.io/2025/11/07/221322_1810074.jpg?imgdimension=look,Universitario vs Panta Walon EN VIVO: sigue la transmisión del encuentro por la gran final del Futsal Pro 2025.
Retiro de AFP: lo que falta para que se debata en el Congreso y por qué el MTPE se opone,https://rpp.pe/economia/economia/retiro-de-afp-lo-que-falta-para-el-debate-en-el-congreso-y-por-que-el-mtpe-se-opone-noticia-1651649,"Wed, 03 Sep 2025 15:00:22 -0500","El ministro Daniel Maurate rechazó nuevos retiros de AFP, ONP y CTS, señalando que debilitan la protección social de los trabajadores. Además, presentó la EDO 2026, encuesta que busca alinear educación y empleo, fortaleciendo el capital humano y la competitividad del país.",Sin categoría,RPP,https://f.rpp-noticias.io/2025/08/28/013901_1786033.jpg?imgdimension=look,"El ministro Daniel Maurate rechazó nuevos retiros de AFP, ONP y CTS, señalando que debilitan la protección social de los trabajadores. Además, presentó la EDO 2026, encuesta que busca alinear educación y empleo, fortaleciendo el capital humano y la competitividad del país."
Precio del dólar Perú y tipo de cambio hoy 07 de noviembre del 2025,https://rpp.pe/economia/economia/precio-del-dolar-peru-y-tipo-de-cambio-hoy-07-de-noviembre-del-2025-noticia-1662800,"Fri, 07 Nov 2025 06:05:39 -0500","En Perú, el tipo de cambio para hoy viernes 07 de noviembre es de  S/3.38 según el Banco Central de Reserva Del Perú.",Sin categoría,RPP,https://f.rpp-noticias.io/2025/08/25/423342_1784718.jpg?imgdimension=look,"En Perú, el tipo de cambio para hoy viernes 07 de noviembre es de  S/3.38 según el Banco Central de Reserva Del Perú."
Arequipa: buzos submarinos y drones buscan a trabajador que desapareció en represa de Aguada Blanca,https://rpp.pe/peru/arequipa/arequipa-buzos-submarinos-y-drones-buscan-a-trabajador-que-desaparecio-en-represa-de-aguada-blanca-noticia-1662900,"Fri, 07 Nov 2025 15:28:04 -0500","Según pudo conocer RPP, los efectivos policiales recorren el embalse utilizando una pequeña balsa, mientras uno de los agentes se sumerge de manera reiterada con equipos especializados.",Sin categoría,RPP,,"Según pudo conocer RPP, los efectivos policiales recorren el embalse utilizando una pequeña balsa, mientras uno de los agentes se sumerge de manera reiterada con equipos especializados."
