titulo,enlace,fecha,descripcion,categoria,fuente,imagen,contenido
Premier League: Empate agónico de Manchester United ante Tottenham con un decisivo gol de Matthijs de Ligt,https://rpp.pe/futbol/ligas-internacionales/premier-league-por-la-fecha-11-tottenham-recibira-a-manchester-united-noticia-1662786,"Sat, 08 Nov 2025 21:45:08 -0500",Tottenham vs Manchester United se enfrentaron por la Inglaterra - Premier League. Aquí todos los detalles y resumen del encuentro.,Sin categoría,RPP,https://f.rpp-noticias.io/2025/11/09/1810524.jpg?imgdimension=look,Tottenham vs Manchester United se enfrentaron por la Inglaterra - Premier League. Aquí todos los detalles y resumen del encuentro.
LaLiga EA Sports: Girona derrotó 1-0 a Alavés con un gol de Viktor Tsygankov,https://rpp.pe/futbol/ligas-internacionales/laliga-ea-sports-girona-se-concentra-para-salir-del-ultimo-lugar-ante-alaves-noticia-1662787,"Sat, 08 Nov 2025 21:40:16 -0500",Girona vs Alavés se enfrentaron por la España - Primera División. Aquí todos los detalles y resumen del encuentro.,Sin categoría,RPP,https://f.rpp-noticias.io/2025/11/09/1810523.jpg?imgdimension=look,Girona vs Alavés se enfrentaron por la España - Primera División. Aquí todos los detalles y resumen del encuentro.
Serie A: Como 1907 y Cagliari no se sacaron ventaja y terminaron sin goles,https://rpp.pe/futbol/ligas-internacionales/serie-a-como-1907-y-cagliari-se-miden-por-la-fecha-11-noticia-1662788,"Sat, 08 Nov 2025 21:35:37 -0500",Como 1907 vs Cagliari se enfrentaron por la Italia - Serie A. Aquí todos los detalles y resumen del encuentro.,Sin categoría,RPP,https://f.rpp-noticias.io/2025/11/09/1810522.jpg?imgdimension=look,Como 1907 vs Cagliari se enfrentaron por la Italia - Serie A. Aquí todos los detalles y resumen del encuentro.
Operativo en Challapalca: incautan equipos tecnológicos en penal presuntamente utilizados para extorsionar,https://rpp.pe/peru/actualidad/operativo-en-challapalca-incautan-equipos-tecnologicos-en-penal-presuntamente-utilizados-para-extorsionar-noticia-1663059,"Sat, 08 Nov 2025 21:37:47 -0500","La intervención se realizó en el pabellón 1, segundo piso (lado “A”). El Inpe indicó que los internos involucrados en este caso serán trasladados al penal de Cochamarca.",Sin categoría,RPP,https://f.rpp-noticias.io/2025/11/08/532953_1810520.jpg?imgdimension=look,"La intervención se realizó en el pabellón 1, segundo piso (lado “A”). El Inpe indicó que los internos involucrados en este caso serán trasladados al penal de Cochamarca."
Panta Walon goleó 4-1 a Universitario y se proclamó campeón del Futsal Pro 2025,https://rpp.pe/futbol/mas-futbol/universitario-vs-panta-walon-en-vivo-a-que-hora-juegan-y-donde-ver-final-liga-futsal-pro-2025-via-youtube-dyj-sports-link-gratis-partidos-de-hoy-noticia-1662902,"Sat, 08 Nov 2025 18:45:45 -0500",Universitario no pudo ante Panta Walon y se quedó con las manos vacias en la gran final del Futsal Pro 2025.,Sin categoría,RPP,https://f.rpp-noticias.io/2025/11/08/160916_1810512.jpg?imgdimension=look,Universitario no pudo ante Panta Walon y se quedó con las manos vacias en la gran final del Futsal Pro 2025.
Serie A: Lecce no pudo con Hellas Verona y empataron sin goles,https://rpp.pe/futbol/ligas-internacionales/serie-a-hellas-verona-se-enfrentara-a-lecce-por-la-fecha-11-noticia-1662789,"Sat, 08 Nov 2025 21:30:33 -0500",Lecce vs Hellas Verona se enfrentaron por la Italia - Serie A. Aquí todos los detalles y resumen del encuentro.,Sin categoría,RPP,https://f.rpp-noticias.io/2025/11/09/1810521.jpg?imgdimension=look,Lecce vs Hellas Verona se enfrentaron por la Italia - Serie A. Aquí todos los detalles y resumen del encuentro.
Universitario ganó 3-0 a Deportivo Soan por la Liga Peruana de Vóley,https://rpp.pe/voley/mas-voley/universitario-vs-deportivo-soan-en-vivo-ver-liga-peruana-de-voley-2025-horario-y-canales-tv-via-latina-voley-en-vivo-noticia-1662850,"Sat, 08 Nov 2025 21:00:32 -0500",Universitario se llevó el triunfo en el partido por la fecha 3 de la Liga Peruana de Vóley.,Sin categoría,RPP,https://f.rpp-noticias.io/2025/11/08/401440_1810514.jpg?imgdimension=look,Universitario se llevó el triunfo en el partido por la fecha 3 de la Liga Peruana de Vóley.
Premier League: Vibrante 3-2 en el triunfo de West Ham United sobre Burnley,https://rpp.pe/futbol/ligas-internacionales/premier-league-west-ham-united-se-enfrentara-ante-burnley-por-la-fecha-11-noticia-1662792,"Sat, 08 Nov 2025 21:20:52 -0500",West Ham United vs Burnley se enfrentaron por la Inglaterra - Premier League. Aquí todos los detalles y resumen del encuentro.,Sin categoría,RPP,https://f.rpp-noticias.io/2025/11/09/1810519.jpg?imgdimension=look,West Ham United vs Burnley se enfrentaron por la Inglaterra - Premier League. Aquí todos los detalles y resumen del encuentro.
Chorrillos: vecinos viven atemorizados por asaltos en la avenida Alameda San Marcos,https://rpp.pe/lima/policiales/chorrillos-vecinos-viven-atemorizados-por-asaltos-en-la-avenida-alameda-san-marcos-noticia-1663058,"Sat, 08 Nov 2025 21:21:43 -0500","En las imágenes captadas por las cámaras de seguridad, los delincuentes intimidaron a sus víctimas con armas de fuego, logrando sustraer sus pertenencias antes de escapar con dirección desconocida.",Sin categoría,RPP,https://f.rpp-noticias.io/2025/11/08/231723_1810516.jpg?imgdimension=look,"En las imágenes captadas por las cámaras de seguridad, los delincuentes intimidaron a sus víctimas con armas de fuego, logrando sustraer sus pertenencias antes de escapar con dirección desconocida."
LaLiga EA Sports: Sevilla derrotó 1-0 a Osasuna con un gol de penal,https://rpp.pe/futbol/ligas-internacionales/laliga-ea-sports-sevilla-luchara-por-vencer-su-racha-negativa-frente-a-osasuna-noticia-1662795,"Sat, 08 Nov 2025 21:15:56 -0500",Sevilla vs Osasuna se enfrentaron por la España - Primera División. Aquí todos los detalles y resumen del encuentro.,Sin categoría,RPP,https://f.rpp-noticias.io/2025/11/09/1810515.jpg?imgdimension=look,Sevilla vs Osasuna se enfrentaron por la España - Primera División. Aquí todos los detalles y resumen del encuentro.
Liga de Francia: Olympique de Marsella sentenció con goleada 3-0 a Stade Brestois,https://rpp.pe/futbol/ligas-internacionales/liga-de-francia-olympique-de-marsella-busca-subir-a-la-cima-del-torneo-noticia-1662801,"Sat, 08 Nov 2025 21:11:09 -0500",Olympique de Marsella vs Stade Brestois se enfrentaron por la Francia - Primera División. Aquí todos los detalles y resumen del encuentro.,Sin categoría,RPP,https://f.rpp-noticias.io/2025/11/09/1810513.jpg?imgdimension=look,Olympique de Marsella vs Stade Brestois se enfrentaron por la Francia - Primera División. Aquí todos los detalles y resumen del encuentro.
"Serie A: Torino y Juventus empataron 0 en el ""Derby Della Mole"" en el Allianz Stadium",https://rpp.pe/futbol/ligas-internacionales/serie-a-juventus-recibe-a-torino-para-disputar-el-derby-della-mole-noticia-1662812,"Sat, 08 Nov 2025 21:07:05 -0500",Juventus vs Torino se enfrentaron por la Italia - Serie A. Aquí todos los detalles y resumen del encuentro.,Sin categoría,RPP,https://f.rpp-noticias.io/2025/11/09/1810511.jpg?imgdimension=look,Juventus vs Torino se enfrentaron por la Italia - Serie A. Aquí todos los detalles y resumen del encuentro.
Premier League: Sunderland saca agónico empate ante Arsenal con gol de Brian Brobbey,https://rpp.pe/futbol/ligas-internacionales/premier-league-arsenal-esta-en-la-cima-y-quiere-mantenerse-asi-al-enfrentar-a-sunderland-noticia-1662816,"Sat, 08 Nov 2025 21:02:14 -0500",Sunderland vs Arsenal se enfrentaron por la Inglaterra - Premier League. Aquí todos los detalles y resumen del encuentro.,Sin categoría,RPP,https://f.rpp-noticias.io/2025/11/09/1810510.jpg?imgdimension=look,Sunderland vs Arsenal se enfrentaron por la Inglaterra - Premier League. Aquí todos los detalles y resumen del encuentro.
¿Qué pasó? El vuelo de la Selección Peruana a Rusia se canceló,https://rpp.pe/futbol/seleccion-peruana/seleccion-peruana-vuelo-de-bicolor-a-rusia-se-cancelo-noticia-1663057,"Sat, 08 Nov 2025 20:34:23 -0500","El vuelo de la Selección Peruana, que jugará ante Rusia y Chile, se ha reprogramado para este domingo.",Sin categoría,RPP,https://f.rpp-noticias.io/2025/11/08/171917_1810505.jpg?imgdimension=look,"El vuelo de la Selección Peruana, que jugará ante Rusia y Chile, se ha reprogramado para este domingo."
Cúal fue el último temblor en México hoy 8 de noviembre según SSN,https://rpp.pe/mundo/mexico/cual-fue-el-ultimo-temblor-en-mexico-hoy-6-de-noviembre-segun-ssn-live-3034,"Thu, 06 Nov 2025 06:27:35 -0500",Cuál es el ultimo temblor en México y CDMX registrado segun el Servicio Sismológico Nacional (SSN) hoy 8 de noviembre del 2025. Consulta los últimos sismos EN VIVO para México aquí.,Sin categoría,RPP,https://f.rpp-noticias.io/2024/11/07/111411_1666676.jpg?imgdimension=look,Cuál es el ultimo temblor en México y CDMX registrado segun el Servicio Sismológico Nacional (SSN) hoy 8 de noviembre del 2025. Consulta los últimos sismos EN VIVO para México aquí.
"Temblor en Perú, hoy 8 de noviembre: magnitud y epicentro del sismo según IGP",https://rpp.pe/lima/desastres-naturales/temblor-en-peru-hoy-6-de-noviembre-magnitud-y-epicentro-del-sismo-segun-igp-live-3033,"Thu, 06 Nov 2025 02:03:58 -0500","Actualización EN VIVO del último sismo en Perú hoy, sábado 8 de noviembre según las últimas actualizaciones del Instituto Geofísico del Perú IGP",Sin categoría,RPP,https://f.rpp-noticias.io/2024/11/04/372237_1665153.jpg?imgdimension=look,"Actualización EN VIVO del último sismo en Perú hoy, sábado 8 de noviembre según las últimas actualizaciones del Instituto Geofísico del Perú IGP"
LaLiga EA Sports: Antoine Griezmann marca un doblete en la victoria 3-1 de Atlético de Madrid ante Levante,https://rpp.pe/futbol/ligas-internacionales/laliga-ea-sports-atletico-de-madrid-buscara-extender-su-racha-ganadora-ante-levante-noticia-1662817,"Sat, 08 Nov 2025 20:57:52 -0500",Atlético de Madrid vs Levante se enfrentaron por la España - Primera División. Aquí todos los detalles y resumen del encuentro.,Sin categoría,RPP,https://f.rpp-noticias.io/2025/11/09/1810509.jpg?imgdimension=look,Atlético de Madrid vs Levante se enfrentaron por la España - Primera División. Aquí todos los detalles y resumen del encuentro.
Liga 1: Partido suspendido entre Ayacucho FC y Comerciantes Unidos,https://rpp.pe/futbol/descentralizado/liga-1-ayacucho-fc-y-comerciantes-unidos-se-miden-por-la-fecha-18-noticia-1662824,"Sat, 08 Nov 2025 20:52:40 -0500",Ayacucho FC vs Comerciantes Unidos se enfrentaron por la Perú - Primera División. Aquí todos los detalles y resumen del encuentro.,Sin categoría,RPP,https://f.rpp-noticias.io/2025/11/09/1810508.jpg?imgdimension=look,Ayacucho FC vs Comerciantes Unidos se enfrentaron por la Perú - Primera División. Aquí todos los detalles y resumen del encuentro.
"Liga de Francia: Sobre el final, Gautier Lloris marcó el gol del empate entre Le Havre AC y Nantes",https://rpp.pe/futbol/ligas-internacionales/liga-de-francia-le-havre-ac-se-enfrenta-ante-la-visita-nantes-por-la-fecha-12-noticia-1662825,"Sat, 08 Nov 2025 20:17:35 -0500",Le Havre AC vs Nantes se enfrentaron por la Francia - Primera División. Aquí todos los detalles y resumen del encuentro.,Sin categoría,RPP,https://f.rpp-noticias.io/2025/11/09/1810504.jpg?imgdimension=look,Le Havre AC vs Nantes se enfrentaron por la Francia - Primera División. Aquí todos los detalles y resumen del encuentro.
Liga MX: Chivas arrolla a CF Monterrey con una contundente victoria por 4-2,https://rpp.pe/futbol/ligas-internacionales/liga-mx-por-la-fecha-17-se-enfrentaran-chivas-y-cf-monterrey-noticia-1662875,"Sat, 08 Nov 2025 20:12:18 -0500",Chivas vs CF Monterrey se enfrentaron por la México - Liga MX. Aquí todos los detalles y resumen del encuentro.,Sin categoría,RPP,https://f.rpp-noticias.io/2025/11/09/1810502.jpg?imgdimension=look,Chivas vs CF Monterrey se enfrentaron por la México - Liga MX. Aquí todos los detalles y resumen del encuentro.
Liga MX: Tigres supera por 3-1 a Atl. de San Luis tras dar vuelta el partido,https://rpp.pe/futbol/ligas-internacionales/liga-mx-tigres-enfrenta-a-atl-de-san-luis-para-subirse-a-la-cima-noticia-1662874,"Sat, 08 Nov 2025 20:12:24 -0500",Tigres vs Atl. de San Luis se enfrentaron por la México - Liga MX. Aquí todos los detalles y resumen del encuentro.,Sin categoría,RPP,https://f.rpp-noticias.io/2025/11/09/1810503.jpg?imgdimension=look,Tigres vs Atl. de San Luis se enfrentaron por la México - Liga MX. Aquí todos los detalles y resumen del encuentro.
Temblor en Chile hoy 8 de noviembre: Epicentro del sismo según CSN,https://rpp.pe/mundo/chile/temblor-en-chile-hoy-8-de-noviembre-epicentro-del-sismo-segun-csn-live-3035,"Sat, 08 Nov 2025 02:09:45 -0500",¿Cuál fue el último Temblor en Chile hoy 8 de noviembre y registrado por el servicio Sismológico Nacional de Chile (CSN)? Consulta los últimos sismos: magnitud y epicentro del movimiento sísmico.,Sin categoría,RPP,https://f.rpp-noticias.io/2024/11/07/363236_1666477.jpg?imgdimension=look,¿Cuál fue el último Temblor en Chile hoy 8 de noviembre y registrado por el servicio Sismológico Nacional de Chile (CSN)? Consulta los últimos sismos: magnitud y epicentro del movimiento sísmico.
No pudo ser: Gonzalo Bueno perdió ante Reis da Silva y quedó eliminado en semifinales del Challenger Lima 3,https://rpp.pe/tenis/mas-tenis/gonzalo-bueno-vs-joao-reis-da-silva-en-vivo-semifinal-final-lima-3-challenger-2025-a-que-hora-juegan-y-donde-ver-por-tv-via-atp-tour-link-gratis-partidos-de-hoy-noticia-1662981,"Sat, 08 Nov 2025 18:15:59 -0500","Gonzalo Bueno perdió ante el brasileño Joao Reis da Silva, que anteriormente superó a Ignacio Buse del Challenger de Lima 3 en el Club Terrazas.",Sin categoría,RPP,https://f.rpp-noticias.io/2025/11/08/402640_1810501.jpg?imgdimension=look,"Gonzalo Bueno perdió ante el brasileño Joao Reis da Silva, que anteriormente superó a Ignacio Buse del Challenger de Lima 3 en el Club Terrazas."
México: juez abre juicio por abuso sexual contra hombre que agredió a Claudia Sheinbaum,https://rpp.pe/mundo/actualidad/mexico-juez-abre-juicio-por-abuso-sexual-contra-hombre-que-agredio-a-claudia-sheinbaum-noticia-1663055,"Sat, 08 Nov 2025 19:30:30 -0500","El martes, cuando Claudia Sheinbaum caminaba por el centro de la capital y saludaba a algunos ciudadanos, un hombre en aparente estado de ebriedad se le acercó, intentó besarla en el cuello y luego abrazarla por la espalda.",Sin categoría,RPP,https://f.rpp-noticias.io/2025/11/08/422142_1810499.jpg?imgdimension=look,"El martes, cuando Claudia Sheinbaum caminaba por el centro de la capital y saludaba a algunos ciudadanos, un hombre en aparente estado de ebriedad se le acercó, intentó besarla en el cuello y luego abrazarla por la espalda."
Sucamec destruye más de 8 200 armas de fuego para evitar su uso con fines delictivos,https://rpp.pe/peru/actualidad/sucamec-destruye-mas-de-8-200-armas-de-fuego-para-evitar-su-uso-con-fines-delictivos-noticia-1663056,"Sat, 08 Nov 2025 19:27:56 -0500",Los restos del metal serán fundidos para su conversión en juegos infantiles y minigimnasios.,Sin categoría,RPP,https://f.rpp-noticias.io/2025/11/08/492149_1810500.jpg?imgdimension=look,Los restos del metal serán fundidos para su conversión en juegos infantiles y minigimnasios.
"Pedro Gallese aclaró los rumores que lo vinculan a Universitario: ""Mi prioridad es quedarme en el extranjero""",https://rpp.pe/futbol/descentralizado/universitario-pedro-gallese-aclara-rumores-que-lo-vinculan-a-la-u-mi-prioridad-es-quedarme-en-el-extranjero-noticia-1663053,"Sat, 08 Nov 2025 19:15:59 -0500","Pedro Gallese dice que se ""tomará su tiempo"" para definir a su próximo club tras su salida de Orlando City.",Sin categoría,RPP,https://f.rpp-noticias.io/2025/11/08/304530_1810494.jpg?imgdimension=look,"Pedro Gallese dice que se ""tomará su tiempo"" para definir a su próximo club tras su salida de Orlando City."
"Murió Maricarmen Vela, actriz que interpretó a Gloria, tía de Paty en ‘El chavo del 8’",https://rpp.pe/famosos/celebridades/murio-maricarmen-vela-actriz-que-interpreto-a-gloria-tia-de-paty-en-el-chavo-del-8-noticia-1663052,"Sat, 08 Nov 2025 18:42:13 -0500","La recordada actriz española nacionalizada mexicana falleció a los 87 años, a solo días de cumplir 88. Participó en exitosas producciones como Papá soltero, Quinceañera y La Rosa de Guadalupe.",Sin categoría,RPP,https://f.rpp-noticias.io/2025/11/08/582958_1810492.jpg?imgdimension=look,"La recordada actriz española nacionalizada mexicana falleció a los 87 años, a solo días de cumplir 88. Participó en exitosas producciones como Papá soltero, Quinceañera y La Rosa de Guadalupe."
José Jerí recibió al BAP Unión tras su viaje de instrucción de seis meses alrededor del mundo,https://rpp.pe/peru/actualidad/jose-jeri-recibio-al-bap-union-tras-su-viaje-de-instruccion-de-seis-meses-alrededor-del-mundo-noticia-1663049,"Sat, 08 Nov 2025 18:31:47 -0500","Durante su viaje, el buque visitó 10 puertos en nueve países, promoviendo los lazos comerciales y culturales del Perú. A bordo, 71 cadetes de la Escuela Naval del Perú completaron su formación con prácticas de maniobra, navegación y liderazgo.",Sin categoría,RPP,https://f.rpp-noticias.io/2025/11/08/254025_1810477.jpg?imgdimension=look,"Durante su viaje, el buque visitó 10 puertos en nueve países, promoviendo los lazos comerciales y culturales del Perú. A bordo, 71 cadetes de la Escuela Naval del Perú completaron su formación con prácticas de maniobra, navegación y liderazgo."
Cristiano Ronaldo anotó en triunfo de Al Nassr: ¿a cuánto quedó de los 1000 goles? [VIDEO],https://rpp.pe/futbol/futbol-mundial/cristiano-ronaldo-anoto-en-triunfo-de-al-nassr-a-cuanto-quedo-de-los-1000-goles-noticia-1663040,"Sat, 08 Nov 2025 18:27:01 -0500","Con Cristiano Ronaldo, Al Nassr venció por 3-1 a Neom FC por la Saudi Pto League.",Sin categoría,RPP,https://f.rpp-noticias.io/2025/11/08/571857_1810443.jpg?imgdimension=look,"Con Cristiano Ronaldo, Al Nassr venció por 3-1 a Neom FC por la Saudi Pto League."
Dua Lipa interpreta ‘De música ligera’ y rinde homenaje a Soda Stereo durante su concierto en Argentina,https://rpp.pe/famosos/celebridades/dua-lipa-interpreta-de-musica-ligera-y-rinde-homenaje-a-soda-stereo-durante-su-concierto-en-argentina-noticia-1663041,"Sat, 08 Nov 2025 18:23:27 -0500","La cantante británica conquistó al público argentino al interpretar el clásico tema de Soda Stereo, reafirmando su conexión con los fans latinoamericanos.",Sin categoría,RPP,https://f.rpp-noticias.io/2025/11/08/542754_1810468.jpg?imgdimension=look,"La cantante británica conquistó al público argentino al interpretar el clásico tema de Soda Stereo, reafirmando su conexión con los fans latinoamericanos."
Rumbo al Perú: se encendió la llama de los Juegos Bolivarianos Ayacucho–Lima 2025,https://rpp.pe/multideportes/mas-deportes/juegos-bolivarianos-ayacucholima-2025-se-encendio-la-llama-bolivariana-en-caracas-venezuela-noticia-1663048,"Sat, 08 Nov 2025 18:17:18 -0500",La vigésima edición de los Juegos Bolivarianos comenzará el 22 de noviembre y se llevará a cabo en Ayacucho y Lima.,Sin categoría,RPP,https://f.rpp-noticias.io/2025/11/08/575657_1810484.jpg?imgdimension=look,La vigésima edición de los Juegos Bolivarianos comenzará el 22 de noviembre y se llevará a cabo en Ayacucho y Lima.
Tabla de posiciones Liga Peruana de Vóley Betsson 2025-26 EN VIVO: así van las posiciones durante la fecha 3,https://rpp.pe/voley/mas-voley/tabla-liga-peruana-de-voley-2025-en-vivo-resultados-en-directo-y-posiciones-de-fase-1-alianza-lima-universitario-regatas-voley-en-vivo-noticia-1661061,"Sat, 08 Nov 2025 18:10:22 -0500",Sigue los resultados y la tabla de posiciones en el comienzo de la Liga Peruana de Vóley Betsson 2025-26.,Sin categoría,RPP,https://f.rpp-noticias.io/2025/10/26/150515_1805606.jpg?imgdimension=look,Sigue los resultados y la tabla de posiciones en el comienzo de la Liga Peruana de Vóley Betsson 2025-26.
Programación de la fecha 3 de la Liga Peruana de Vóley 2025-2026: todas las fechas y horarios de los partidos,https://rpp.pe/voley/mas-voley/liga-peruana-de-voley-2025-2026-programacion-de-la-fecha-3-fixture-fecha-y-horario-de-los-partidos-alianza-lima-universitario-san-martin-regatas-lpv-noticia-1662090,"Sat, 08 Nov 2025 16:00:07 -0500",Conoce las fechas y horarios de los partidos de la jornada 3 de la primera etapa de la Liga Peruana de Vóley.,Sin categoría,RPP,https://f.rpp-noticias.io/2025/11/02/280728_1808110.jpg?imgdimension=look,Conoce las fechas y horarios de los partidos de la jornada 3 de la primera etapa de la Liga Peruana de Vóley.
Tabla de posiciones de Liga 1 Te Apuesto 2025 EN VIVO: así está el Acumulado y el Clausura en la fecha 18,https://rpp.pe/futbol/descentralizado/tabla-acumulada-liga-1-y-torneo-clausura-2025-en-vivo-resultados-y-posiciones-tras-partidos-de-hoy-universitario-alianza-lima-sporting-cristal-noticia-1647030,"Sat, 08 Nov 2025 17:50:26 -0500","Sigue el movimiento de las posiciones y cómo va la Tabla Acumulada de la Liga1 Te Apuesto 2025. Se definen los playoffs, los cupos internacionales y el descenso.",Sin categoría,RPP,https://f.rpp-noticias.io/2025/07/18/503150_1771847.jpg?imgdimension=look,"Sigue el movimiento de las posiciones y cómo va la Tabla Acumulada de la Liga1 Te Apuesto 2025. Se definen los playoffs, los cupos internacionales y el descenso."
Chorrillos: familia se reencuentra con abuelito de 87 años que estuvo desaparecido,https://rpp.pe/rotafono/servicios-a-la-comunidad/chorrillos-familia-se-reencuentra-con-abuelito-de-87-anos-que-estuvo-desaparecido-noticia-1663051,"Sat, 08 Nov 2025 17:48:46 -0500",Rotafono de RPP | Víctor Castillo Manrique fue hallado por policías de Lurín después de que estuviera perdido por un día.,Sin categoría,RPP,https://f.rpp-noticias.io/2025/11/08/044304_1810478.jpg?imgdimension=look,Rotafono de RPP | Víctor Castillo Manrique fue hallado por policías de Lurín después de que estuviera perdido por un día.
¡Cerca de la salvación! Juan Pablo II venció 3-1 a Atlético Grau por la penúltima fecha del Clausura (VIDEO),https://rpp.pe/futbol/descentralizado/juan-pablo-ii-vs-atletico-grau-en-vivo-a-que-hora-juegan-y-en-que-canal-ver-fecha-18-torneo-clausura-2025-via-l1max-partidos-de-hoy-noticia-1662936,"Sat, 08 Nov 2025 17:35:18 -0500","Con un doblete de Christian Tizón, Juan Pablo II sigue dependiendo de sí mismo para evitar el descenso a la Liga2. Además, Alianza Universidad ya perdió la categoría.",Sin categoría,RPP,https://f.rpp-noticias.io/2025/11/08/583158_1810469.jpg?imgdimension=look,"Con un doblete de Christian Tizón, Juan Pablo II sigue dependiendo de sí mismo para evitar el descenso a la Liga2. Además, Alianza Universidad ya perdió la categoría."
San Juan de Miraflores: obrero desaparece cuando se dirigía a su trabajo,https://rpp.pe/rotafono/servicios-a-la-comunidad/san-juan-de-miraflores-obrero-desaparece-cuando-se-dirigia-a-su-trabajo-noticia-1663035,"Sat, 08 Nov 2025 14:08:23 -0500","Rotafono de RPP | ¿Lo has visto? La familia de Ruperto Rivera Ramírez, de 61 años, busca ayuda para localizarlo.",Sin categoría,RPP,https://f.rpp-noticias.io/2025/11/08/070407_1810425.jpg?imgdimension=look,"Rotafono de RPP | ¿Lo has visto? La familia de Ruperto Rivera Ramírez, de 61 años, busca ayuda para localizarlo."
Liga 1: Doblete de Cristhian Tizón guió el triunfo 3-1 de Juan Pablo II sobre Grau,https://rpp.pe/futbol/descentralizado/liga-1-juan-pablo-ii-y-grau-se-encuentran-en-la-fecha-18-noticia-1662843,"Sat, 08 Nov 2025 17:37:56 -0500",Juan Pablo II vs Grau se enfrentaron por la Perú - Primera División. Aquí todos los detalles y resumen del encuentro.,Sin categoría,RPP,https://f.rpp-noticias.io/2025/11/08/1810476.jpg?imgdimension=look,Juan Pablo II vs Grau se enfrentaron por la Perú - Primera División. Aquí todos los detalles y resumen del encuentro.
Liga de Francia: Wesley Said impulsó la victoria 4-1 de Lens frente a Mónaco con dos goles,https://rpp.pe/futbol/ligas-internacionales/liga-de-francia-lens-busca-derrotar-a-monaco-para-posicionarse-en-la-cima-del-torneo-noticia-1662839,"Sat, 08 Nov 2025 17:17:53 -0500",Mónaco vs Lens se enfrentaron por la Francia - Primera División. Aquí todos los detalles y resumen del encuentro.,Sin categoría,RPP,https://f.rpp-noticias.io/2025/11/08/1810467.jpg?imgdimension=look,Mónaco vs Lens se enfrentaron por la Francia - Primera División. Aquí todos los detalles y resumen del encuentro.
Buenas noticias: Censo Nacional de Vicuñas contabiliza más de 300 mil ejemplares a nivel nacional [FOTOS],https://rpp.pe/peru/actualidad/censo-nacional-de-vicunas-contabiliza-mas-de-300-mil-ejemplares-a-nivel-nacional-fotos-noticia-1663046,"Sat, 08 Nov 2025 16:16:11 -0500","El director ejecutivo del Serfor, Erasmo Otárola, destacó que una de las principales novedades del censo fue el hallazgo de nuevas poblaciones de vicuñas en Áncash y Huánuco.",Sin categoría,RPP,,"El director ejecutivo del Serfor, Erasmo Otárola, destacó que una de las principales novedades del censo fue el hallazgo de nuevas poblaciones de vicuñas en Áncash y Huánuco."
