titulo,enlace,fecha,descripcion,categoria,fuente,imagen,contenido
Frente frío proveniente del Polo Norte llega este fin de semana a EE.UU.: qué estados tendrán bajas temperaturas desde el viernes 7 de noviembre,https://elcomercio.pe/mag/usa/local-us/frente-frio-proveniente-del-polo-norte-llega-este-fin-de-semana-a-estados-unidos-que-estados-tendran-bajas-temperaturas-desde-el-viernes-7-de-noviembre-nnda-nnni-noticia/,"Fri, 07 Nov 2025 21:39:02 +0000",La irrupción del aire ártico traerá las primeras sensaciones del invierno a millones de personas.,Sin categoría,El Comercio,https://elcomercio.pe/resizer/v2/4FJISJD3AJCJ3CWHWK4BWOS3OY.jpg?width=1200&height=800&auth=75b81e61900c9e48a0461378f7e9c5072d4b482e5f83e84b76572783bca0c308&smart=true,La irrupción del aire ártico traerá las primeras sensaciones del invierno a millones de personas.
"¿Quién ganó la Lotería de Medellín HOY, viernes 7 de noviembre? Conoce el número ganador del sorteo",https://elcomercio.pe/respuestas/colombia/quien-gano-la-loteria-de-medellin-hoy-viernes-7-de-noviembre-revisa-el-numero-ganador-del-sorteo-chance-colombia-tdpe-noticia/,"Fri, 07 Nov 2025 21:39:00 +0000",Consulta aquí el número ganador de la Lotería de Medellín de este viernes.,Sin categoría,El Comercio,https://elcomercio.pe/resizer/v2/C4YZ6ATNPRBVRO3AXXH5WUH6GM.jpg?width=1600&height=900&auth=f2e348cead8648d24ca0d3b6054353b7b073d5bf0c8fafad1b1ed5d82484c68f&smart=true,Consulta aquí el número ganador de la Lotería de Medellín de este viernes.
¿Seguro para celulares ante robo o incidentes? La Positiva amplía cobertura: “Esta demanda se ha incrementado de forma muy importante”,https://elcomercio.pe/economia/negocios/cade-ejecutivos-2025-la-positiva-sobre-seguro-para-celulares-la-demanda-se-ha-incrementado-de-forma-muy-importante-noticia/,"Fri, 07 Nov 2025 21:38:49 +0000","Alberto Vásquez, gerente general de La Positiva, adelantó que la compañía prevé cerrar el año con ingresos de hasta S/3.100 millones y alista un acuerdo para ofrecer servicios especializados de telemedicina antes que culmine el año. | CADE Ejecutivos 2025",Sin categoría,El Comercio,https://elcomercio.pe/resizer/v2/JRGVZWKXD5EZDLG36YI6D7O7SU.jpg?width=6720&height=4480&auth=10139027b1436fbabe978bed5ff8e4d07890549b4e633491e1eeff8ce1d76783&smart=true,"Alberto Vásquez, gerente general de La Positiva, adelantó que la compañía prevé cerrar el año con ingresos de hasta S/3.100 millones y alista un acuerdo para ofrecer servicios especializados de telemedicina antes que culmine el año. | CADE Ejecutivos 2025"
Eficiencia operacional: el gran reto para volar más limpio,https://elcomercio.pe/economia/opinion/eficiencia-operacional-el-gran-reto-para-volar-mas-limpio-por-jose-raul-vargas-sky-airline-opinion-noticia/,"Fri, 07 Nov 2025 11:35:00 +0000","José Raúl Vargas, gerente general de Sky Airline en Perú, reflexiona sobre los desafíos y oportunidades de la aviación en la lucha contra el cambio climático. Más allá del uso del SAF, la eficiencia operacional, la renovación de flota y la cooperación entre industria y Estado son claves para reducir la huella de carbono y construir una aviación más sostenible en Latinoamérica.",Sin categoría,El Comercio,https://elcomercio.pe/resizer/v2/3SP4MKAYYNDXTOLUME3UW4WFSQ.jpeg?width=1600&height=1143&auth=eabb207d1797c8899f5b15fe5f7ca4a66085f2227805fed9d0ec8b7bace820f2&smart=true,"José Raúl Vargas, gerente general de Sky Airline en Perú, reflexiona sobre los desafíos y oportunidades de la aviación en la lucha contra el cambio climático. Más allá del uso del SAF, la eficiencia operacional, la renovación de flota y la cooperación entre industria y Estado son claves para reducir la huella de carbono y construir una aviación más sostenible en Latinoamérica."
Nuevo RETIRO AFP - Cronograma en noviembre 2025: consulta quién puede solicitar y en qué fechas,https://elcomercio.pe/respuestas/tramites/retiro-de-afp-2025-revisa-aqui-quienes-pueden-solicitarlo-durante-este-mes-de-noviembre-tdpe-noticia/,"Fri, 07 Nov 2025 21:38:23 +0000",Retiro de AFP 2025: Revisa AQUÍ quiénes pueden solicitarlo durante este mes de noviembre,Sin categoría,El Comercio,https://elcomercio.pe/resizer/v2/HFGY6RDD6NBCRC4RAA7WSCJH2E.png?width=1400&height=800&auth=f291eb5040643715189d54309c198e04e520acfadb988d4003210e85799f023e&smart=true,Retiro de AFP 2025: Revisa AQUÍ quiénes pueden solicitarlo durante este mes de noviembre
Cómo generar empleo de calidad: los retos para impulsar trabajo formal y sostenible en el Perú,https://elcomercio.pe/economia/dia-1/como-generar-empleo-de-calidad-los-retos-para-impulsar-trabajo-formal-y-sostenible-en-el-peru-cade-ejecutvios-cade-ejecutivos-2025-noticia/,"Fri, 07 Nov 2025 21:38:11 +0000","En un contexto de crecimiento lento, alta informalidad y lenta recuperación de la inversión privada, empresarios, gremios y especialistas coinciden en que el país necesita reglas claras, mayor productividad y políticas que reduzcan la brecha laboral.",Sin categoría,El Comercio,https://elcomercio.pe/resizer/v2/VXFTINXHYNDGJPHFK4SNGIUCPY.jpg?width=580&height=330&auth=4472d5a88f876938a902fbc4120c85342493cadc2b91d6cbd6dcb174f7f3e4db&smart=true,"En un contexto de crecimiento lento, alta informalidad y lenta recuperación de la inversión privada, empresarios, gremios y especialistas coinciden en que el país necesita reglas claras, mayor productividad y políticas que reduzcan la brecha laboral."
IIMP en CADE Ejecutivos 2025: “La Ley MAPE tiene una regulación y está en la Ley General de Minería”,https://elcomercio.pe/economia/cade-ejecutivos-2025-iimp-la-ley-mape-tiene-una-regulacion-y-esta-en-la-ley-general-de-mineria-cade-ejecutivos-noticia/,"Fri, 07 Nov 2025 21:37:53 +0000",El gerente general del IIMP señaló que la ejecución del proyecto Tía María marca una pauta para la ejecución de otras obras mineras.,Sin categoría,El Comercio,https://elcomercio.pe/resizer/v2/RVIKRZOHWRBRVL5HWJA5JPJP34.jpeg?width=1280&height=854&auth=2a31846ad2fcbbc1f87de9d18a2cdadd3b126ce5528875b2d0133adc50fcbf95&smart=true,El gerente general del IIMP señaló que la ejecución del proyecto Tía María marca una pauta para la ejecución de otras obras mineras.
Larraín: “La neutralidad empresarial es una complicidad por omisión; los empresarios deben opinar sobre los cambios institucionales”,https://elcomercio.pe/economia/bernardo-larrain-la-neutralidad-empresarial-es-una-complicidad-por-omision-los-empresarios-deben-opinar-sobre-los-cambios-institucionales-noticia/,"Fri, 07 Nov 2025 21:37:36 +0000","El presidente del Directorio de CMPC, Bernardo Larraín, llama al empresariado latinoamericano a involucrarse activamente en la política y el fortalecimiento institucional. En una entrevista exclusiva, sostiene que “la neutralidad es una complicidad por omisión” y que la región no alcanzará su potencial económico mientras persista la inestabilidad política. Destaca además la importancia del Perú como mercado estratégico para CMPC y el talento empresarial local.",Sin categoría,El Comercio,https://elcomercio.pe/resizer/v2/W5PY7LHSW5HBTPV4VN4LLZHF5U.jpg?width=6720&height=4480&auth=1717188c43acf7bb9f7e541125073236a9389ca7ade026efae265462bf1e3e62&smart=true,"El presidente del Directorio de CMPC, Bernardo Larraín, llama al empresariado latinoamericano a involucrarse activamente en la política y el fortalecimiento institucional. En una entrevista exclusiva, sostiene que “la neutralidad es una complicidad por omisión” y que la región no alcanzará su potencial económico mientras persista la inestabilidad política. Destaca además la importancia del Perú como mercado estratégico para CMPC y el talento empresarial local."
Promigas demanda al Estado:“Nos vemos obligados a iniciar la etapa formal de trato directo para un eventual arbitraje internacional”,https://elcomercio.pe/economia/peru/promigas-demanda-al-estado-nos-vemos-obligados-a-iniciar-la-etapa-formal-de-trato-directo-cade-ejecutivos-cade-ejecutivos-2025-noticia/,"Fri, 07 Nov 2025 21:37:21 +0000","El gerente general de Promigas detalló que el proceso iniciará mañana. Si no se llega a un acuerdo, avanzarán con la demanda. Hasta ahora, el Estado no les ha dado ninguna respuesta.",Sin categoría,El Comercio,https://elcomercio.pe/resizer/v2/HAD6Z5PQYVCEDM2TQGPMI66OAU.jpg?width=1280&height=854&auth=69d94f55531c30ac2eba005f245daa4a2fba4dc9c563c1c2fd461193d4a28432&smart=true,"El gerente general de Promigas detalló que el proceso iniciará mañana. Si no se llega a un acuerdo, avanzarán con la demanda. Hasta ahora, el Estado no les ha dado ninguna respuesta."
¿La inestabilidad política afecta a las proyecciones de los sectores económicos del país? Esto dicen especialistas,https://elcomercio.pe/economia/dia-1/la-inestabilidad-politica-afecta-a-las-proyecciones-de-los-sectores-economicos-del-pais-cade-ejecutivos-2025-inversion-privada-noticia/,"Fri, 07 Nov 2025 21:37:07 +0000","Expertos sostienen que el último remezón político no tuvo un impacto económico inmediato relevante. No obstante, hacia inicios del 2026, se espera mayor cautela. Inversión privada, construcción y manufactura registrarían un menor crecimiento.",Sin categoría,El Comercio,https://elcomercio.pe/resizer/v2/UZBOTVSZU5EBJISFVDIEEAJGSI.jpg?width=1154&height=647&auth=ae672e56e8ae6182a5438e29838ef89e357048a855b30bb966fb4285d7143647&smart=true,"Expertos sostienen que el último remezón político no tuvo un impacto económico inmediato relevante. No obstante, hacia inicios del 2026, se espera mayor cautela. Inversión privada, construcción y manufactura registrarían un menor crecimiento."
Llega el frente frío a EE.UU.: cómo proteger tu coche si vas a manejar en carreteras congeladas,https://elcomercio.pe/mag/usa/local-us/llega-el-frente-frio-a-estados-unidos-como-proteger-tu-coche-si-vas-a-manejar-en-carreteras-congeladas-nnda-nnni-noticia/,"Fri, 07 Nov 2025 21:37:00 +0000",Aquí las claves para conducir de forma segura sobre hielo y nieve.,Sin categoría,El Comercio,https://elcomercio.pe/resizer/v2/WMZPCZJ6AVH65GCEJML3LFM32Y.jpg?width=1200&height=800&auth=f4efd1ee24396abd865a6864ffd175cb65943dc48e2dd72a2977b63fe195d71d&smart=true,Aquí las claves para conducir de forma segura sobre hielo y nieve.
"Trazando la ruta para la reconstrucción del país, ¿cómo resolver la inseguridad y la corrupción para impulsar la economía?",https://elcomercio.pe/economia/peru/trazando-la-ruta-para-la-reconstruccion-del-pais-casa-andina-talma-luz-del-sur-hunt-oil-company-noticia/,"Fri, 07 Nov 2025 21:36:53 +0000","Los CEO de empresas como Hunt Oil Company, Casa Andina, Talma y Luz del Sur califican a la corrupción, la inseguridad ciudadana y a las economías ilegales como los principales males del país.",Sin categoría,El Comercio,https://elcomercio.pe/resizer/v2/7J57MUMOTZE2XGA4SAISS3ODJY.jpg?width=619&height=347&auth=5a1b090a5a9e1aaa02521a23f1e244da707730b24a837b585b5a3333de7511fc&smart=true,"Los CEO de empresas como Hunt Oil Company, Casa Andina, Talma y Luz del Sur califican a la corrupción, la inseguridad ciudadana y a las economías ilegales como los principales males del país."
Trujillo: el momento en que delincuentes encañonan a empresario y le roban 80 mil dólares,https://elcomercio.pe/videos/pais/trujillo-el-momento-en-que-delincuentes-encanonan-a-empresario-y-le-roban-80-mil-dolares-nnav-video-latv-noticia/,"Fri, 07 Nov 2025 21:36:43 +0000","En pleno centro de Trujillo, las cámaras de seguridad registraron cómo unos ladrones, que seguían a su víctima bajo el método de “marcas”, interceptaron a un empresario y le quitaron los 80 mil dólares que acababa de sacar del banco.",Sin categoría,El Comercio,https://elcomercio.pe/resizer/v2/GG4JF6RTJZA3NC5YDIMF4VUXL4.jpg?width=1920&height=1080&auth=8fe749021f5e30a1521090ea5244c48be9346b1eec1cdc12badce01bb0471c3a&smart=true,"En pleno centro de Trujillo, las cámaras de seguridad registraron cómo unos ladrones, que seguían a su víctima bajo el método de “marcas”, interceptaron a un empresario y le quitaron los 80 mil dólares que acababa de sacar del banco."
Frente frío impacta Estados Unidos: el mapa de las ciudades afectadas con bajas temperaturas este 8 y 9 de noviembre,https://elcomercio.pe/mag/usa/local-us/frente-frio-impacta-estados-unidos-el-mapa-de-las-ciudades-afectadas-con-bajas-temperaturas-este-8-y-9-de-noviembre-nnda-nnni-noticia/,"Fri, 07 Nov 2025 21:36:01 +0000",Una masa de aire ártico avanzará este fin de semana sobre gran parte de EE.UU.,Sin categoría,El Comercio,https://elcomercio.pe/resizer/v2/YP26A4UUSFCJFPKXEXUE6UEMPQ.jpg?width=1200&height=800&auth=5b2287e0a4da2b65c6359a9173783071d9cf85aa372ef49d7827cb2fce94152e&smart=true,Una masa de aire ártico avanzará este fin de semana sobre gran parte de EE.UU.
"Si no tienes papeletas, el MTC te premia: descubre cómo acceder al beneficio",https://elcomercio.pe/respuestas/tramites/si-no-tienes-papeletas-el-mtc-te-premia-descubre-el-beneficio-y-como-acceder-brevete-2025-tdpe-noticia/,"Fri, 07 Nov 2025 21:35:33 +0000",La iniciativa del MTC busca promover la seguridad vial y reconocer la responsabilidad de los conductores que mantienen un historial sin infracciones. Aquí los detalles,Sin categoría,El Comercio,https://elcomercio.pe/resizer/v2/O53HQENLOJEQ5J6XAVVQMLT25I.jpg?width=1280&height=853&auth=78e4628460f0d55666cf01b653a64dd30ba4ae1c52e45d5ecf7b0d00d9b3fb94&smart=true,La iniciativa del MTC busca promover la seguridad vial y reconocer la responsabilidad de los conductores que mantienen un historial sin infracciones. Aquí los detalles
“Sábado en la noche empezará a bajar la temperatura”: meteoróloga alerta sobre dos frentes fríos que llegan a Texas,https://elcomercio.pe/mag/usa/local-us/sabado-en-la-noche-empezara-a-bajar-la-temperatura-meteorologa-alerta-sobre-dos-frentes-frios-que-llegan-a-texas-nnda-nnni-noticia/,"Fri, 07 Nov 2025 21:34:48 +0000",El frente frío traerá un giro total al pronóstico del tiempo.,Sin categoría,El Comercio,https://elcomercio.pe/resizer/v2/23J6BJDU35DWBIY7LNZKWYWGMM.jpg?width=1200&height=800&auth=da404bc91abce12a249721b5193479f4c6faea5de13b31cb00b79bf7c482d6c8&smart=true,El frente frío traerá un giro total al pronóstico del tiempo.
Festivos 2025 y puentes en Colombia: revisa el calendario con últimos feriados del año,https://elcomercio.pe/respuestas/colombia/conoce-los-ultimos-feriados-del-2025-en-colombia-festivos-y-puentes-para-fin-de-ano-tdpe-noticia/,"Fri, 07 Nov 2025 21:34:45 +0000",¡Atención! Estos son los próximos festivos a celebrarse durante el mes de noviembre 2025.,Sin categoría,El Comercio,https://elcomercio.pe/resizer/v2/WRBNH4NHNJHP7C4W2E7AK6YZVA.jpg?width=1600&height=900&auth=61c34e7e71f53b5b23c8ba86a6f057fd99c5946794a5fb775b5846f59d5beab0&smart=true,¡Atención! Estos son los próximos festivos a celebrarse durante el mes de noviembre 2025.
Tabla de Liga 1 en vivo: así van las posiciones tras victoria de Cusco FC,https://elcomercio.pe/deporte-total/futbol-peruano/tabla-de-posiciones-liga-1-en-vivo-hoy-como-va-el-acumulado-y-clausura-en-fecha-18-con-universitario-alianza-lima-cristal-y-cusco-fc-noticia/,"Fri, 07 Nov 2025 21:33:49 +0000","Tabla de la Liga 1 2025 EN VIVO HOY, viernes 7 de noviembre: conoce las posiciones del Torneo Clausura y el Acumulado.",Sin categoría,El Comercio,https://elcomercio.pe/resizer/v2/EFR46JRA7VGSLEQ5HHWMJL5F24.jpg?width=1040&height=600&auth=a836738ca596b054dfbdffe16a78d5bbc483d260b61de2dab0ae4c9215874222&smart=true,"Tabla de la Liga 1 2025 EN VIVO HOY, viernes 7 de noviembre: conoce las posiciones del Torneo Clausura y el Acumulado."
¡Sorpresa en el Gallardo! Souza puso el 1-0 para Cienciano ante Cristal | VIDEO,https://elcomercio.pe/deporte-total/futbol-peruano/gol-de-cristian-souza-hoy-en-el-sporting-cristal-vs-cienciano-por-el-torneo-clausura-liga-1-te-apuesto-video-noticia/,"Fri, 07 Nov 2025 21:33:48 +0000",El atacante uruguayo adelantó para los cusqueños ante Cristal por la fecha 18 del Torneo Clausura de la Liga 1 Te Apuesto.,Sin categoría,El Comercio,https://elcomercio.pe/resizer/v2/77QYBKRHZFDQNOQ2RMD3YODOBQ.png?width=640&height=360&auth=74be2e4d17070a129cd0e16b45c556cb08ae5e15364c98cc5dae098e595cd1e3&smart=true,El atacante uruguayo adelantó para los cusqueños ante Cristal por la fecha 18 del Torneo Clausura de la Liga 1 Te Apuesto.
"LINK LIGA 1 MAX EN VIVO, Sporting Cristal vs. Cienciano HOY por Torneo Clausura",https://elcomercio.pe/deporte-total/futbol-peruano/liga-1-max-en-vivo-sporting-cristal-vs-cienciano-online-gratis-via-futbol-libre-tv-liga-1-play-directv-por-torneo-clausura-de-liga-1-link-video-noticia/,"Fri, 07 Nov 2025 21:32:58 +0000",Liga 1 Max EN VIVO: transmite el partido de Sporting Cristal vs. Cienciano por la fecha 18 del Torneo Clausura de la Liga 1.,Sin categoría,El Comercio,https://elcomercio.pe/resizer/v2/B57YEJIUQFFLBC7U73M3UZ57RY.jpg?width=1080&height=643&auth=b0f97cda6e36aa081ddcecbc23b45e05cdd149fd722ee758c2d3c3113f3cf461&smart=true,Liga 1 Max EN VIVO: transmite el partido de Sporting Cristal vs. Cienciano por la fecha 18 del Torneo Clausura de la Liga 1.
Pago de la CTS noviembre 2025: conoce el monto que recibirás y el plazo para cobrarlo,https://elcomercio.pe/respuestas/tramites/cts-noviembre-2025-conoce-el-monto-que-recibiras-y-el-plazo-para-cobrarlo-tdpe-noticia/,"Fri, 07 Nov 2025 21:32:27 +0000",CTS noviembre 2025: conoce el monto que recibirás y el plazo para cobrarlo,Sin categoría,El Comercio,https://elcomercio.pe/resizer/v2/M3UZMVNB5VHIFOER7EJAEWWHMY.jpg?width=1400&height=800&auth=f25ebe92293b23e0ef731f458718e0c2735c35f0ac6add27acafd3e26024c0e9&smart=true,CTS noviembre 2025: conoce el monto que recibirás y el plazo para cobrarlo
La reducción del tráfico aéreo por el cierre del Gobierno en EE.UU. podría llegar al 20 %,https://elcomercio.pe/mundo/eeuu/la-reduccion-del-trafico-aereo-por-el-cierre-del-gobierno-en-estados-unidos-podria-llegar-al-20-noticia/,"Fri, 07 Nov 2025 21:30:00 +0000","“El segundo pago se realiza este martes, por lo que, si el cierre no termina relativamente pronto, más controladores no acudirán al trabajo”, explicó el secretario de Transporte de EE.UU.",Sin categoría,El Comercio,https://elcomercio.pe/resizer/v2/G4WO4K2DNVCW7IPNAXT6ITTMTY.jpg?width=1200&height=800&auth=05ca61512d60ad7f20c4c49da072011c523c58af467ffad4841a4050c8fcca5a&smart=true,"“El segundo pago se realiza este martes, por lo que, si el cierre no termina relativamente pronto, más controladores no acudirán al trabajo”, explicó el secretario de Transporte de EE.UU."
"La Caribeña hoy, viernes 7 de noviembre: Números ganadores del sorteo",https://elcomercio.pe/respuestas/colombia/quien-gano-la-loteria-la-caribena-dia-y-noche-hoy-en-vivo-conoce-los-numeros-ganadores-del-sorteo-chance-colombia-tdpe-noticia/,"Fri, 07 Nov 2025 21:28:52 +0000",Consulta aquí los resultados de la lotería La Caribeña Día y Noche. Te deseamos mucha suerte.,Sin categoría,El Comercio,https://elcomercio.pe/resizer/v2/M2F7EX345RH7TFVRSZFAIOGXBI.jpg?width=1600&height=900&auth=f920f5e5099233466f400cbed08fb4f631d1398b8411ae07615002745ca0d0a5&smart=true,Consulta aquí los resultados de la lotería La Caribeña Día y Noche. Te deseamos mucha suerte.
"Powerball del sábado 8 de noviembre: resultados, cómo jugar y monto del jackpot",https://elcomercio.pe/respuestas/usa/powerball-online-en-vivo-hoy-resultados-del-sabado-8-de-noviembre-de-2025-winning-numbers-mega-millions-cash-value-double-play-washington-eeuu-usa-lbposting-noticia/,"Fri, 07 Nov 2025 21:27:38 +0000",Powerball EN VIVO ONLINE del sábado 8 de noviembre del 2025: revisa aquí los resultados de la lotería más popular de Estados Unidos. También sigue el sorteo y los números ganadores del Double Play.,Sin categoría,El Comercio,https://elcomercio.pe/resizer/v2/2XLTV7SEH5BIVL2RYQ4FK4ABTY.jpg?width=1200&height=700&auth=2ee764e1a8809ece31ccf445e522bec1e57ce350299d9a4e585c9a1b993d48cb&smart=true,Powerball EN VIVO ONLINE del sábado 8 de noviembre del 2025: revisa aquí los resultados de la lotería más popular de Estados Unidos. También sigue el sorteo y los números ganadores del Double Play.
Amy Gutiérrez revela su deseo de grabar una colaboración con Gian Marco: “Es una inspiración”,https://elcomercio.pe/tvmas/farandula/amy-gutierrez-revela-su-deseo-de-grabar-una-colaboracion-con-gian-marco-es-una-inspiracion-ultimas-noticia/,"Fri, 07 Nov 2025 21:23:51 +0000",La cantante ofreció una reveladora entrevista en la que confesó su deseo por grabar al lado del reconocido artista peruano.,Sin categoría,El Comercio,https://elcomercio.pe/resizer/v2/KQ3OBPEHRVBYLGCD3CVCGFUB64.jpg?width=1214&height=800&auth=09e12232b4dbe6d5b08bbac3f1f35e317358e0ae7496d6744bc877a38bbb9618&smart=true,La cantante ofreció una reveladora entrevista en la que confesó su deseo por grabar al lado del reconocido artista peruano.
"Garou continúa luchando: fecha de estreno, hora confirmada y link para ver “One-Punch Man” - Temporada 3 Episodio 5",https://elcomercio.pe/mag/fama/que-ver/one-punch-man-temporada-2-episodio-5-online-fecha-hora-y-link-para-ver-el-anime-video-nnda-nnlt-noticia/,"Fri, 07 Nov 2025 21:21:59 +0000","En el quinto episodio de la temporada 3 de “One-Punch Man”, Garou es atacado por Pochi, un monstruo gigante de nivel desastre Dragón.",Sin categoría,El Comercio,https://elcomercio.pe/resizer/v2/QYODGWDIGFDENH2CT45KQI3JII.jpg?width=2400&height=1620&auth=1b9fd974e534f6a8c9ec35b2369382b32c32f0237f4b2bfcdbda3b7bf60c22c9&smart=true,"En el quinto episodio de la temporada 3 de “One-Punch Man”, Garou es atacado por Pochi, un monstruo gigante de nivel desastre Dragón."
"Resultados Sinuano hoy, viernes 7 de noviembre: Números ganadores del sorteo",https://elcomercio.pe/respuestas/colombia/quien-gano-la-loteria-sinuano-dia-y-noche-hoy-en-vivo-conoce-los-numeros-ganadores-del-sorteo-chance-colombia-tdpe-noticia/,"Fri, 07 Nov 2025 21:23:15 +0000",Consulta en esta nota los últimos resultados del Sinuano Día y Noche.,Sin categoría,El Comercio,https://elcomercio.pe/resizer/v2/I746LA4W5NB3RBR7FCWIHVESCU.jpg?width=1600&height=900&auth=06299413c5a9154460c0bddc67711711f6e477264dab25daab313c0238597952&smart=true,Consulta en esta nota los últimos resultados del Sinuano Día y Noche.
"La gran guerra de Elbaph: fecha de estreno, hora confirmada y link para ver “One Piece” - Episodio 1149",https://elcomercio.pe/mag/fama/que-ver/one-piece-episodio-1149-online-fecha-hora-y-link-para-ver-el-anime-video-nnda-nnlt-noticia/,"Fri, 07 Nov 2025 20:02:58 +0000","El nuevo episodio del “One Piece”, popular y longevo anime, se centra en el contraataque de los protagonistas contra los Caballeros Sagrados.",Sin categoría,El Comercio,https://elcomercio.pe/resizer/v2/57TFJSRUMBCMLPJYGHS4NWSRPE.jpg?width=2400&height=1620&auth=fc569744e008c6b206c747dfc6f2486fc0344cd706a156a9fcfbc76bd04a881e&smart=true,"El nuevo episodio del “One Piece”, popular y longevo anime, se centra en el contraataque de los protagonistas contra los Caballeros Sagrados."
Millie Bobby Brown pone fin a los rumores de ‘denuncia’ y elogia a David Harbour: “Es muy especial tenerlo a mi lado”,https://elcomercio.pe/mag/fama/celebs/millie-bobby-brown-pone-fin-a-los-rumores-de-denuncia-y-elogia-a-david-harbour-es-muy-especial-tenerlo-a-mi-lado-nnda-nnrt-noticia/,"Fri, 07 Nov 2025 21:12:52 +0000","Durante la premiere de la quinta y última temporada de ‘Stranger Things’, la actriz que interprete a ‘Once’ dedicó unas palabras emotivas hacia David Harbour, poniendo fin a los rumores de una mala relación entre ambos.",Sin categoría,El Comercio,https://elcomercio.pe/resizer/v2/B25THS22UJD6PGP6G72TBYTSFM.jpg?width=1600&height=1200&auth=ef435ff74982492169546c25f69f7e7b62b435394d9bc52778154718f81b638c&smart=true,"Durante la premiere de la quinta y última temporada de ‘Stranger Things’, la actriz que interprete a ‘Once’ dedicó unas palabras emotivas hacia David Harbour, poniendo fin a los rumores de una mala relación entre ambos."
"“No sé si puedo anunciar esto, pero lo voy a hacer”: Jennifer Lawrence y la nueva película en la que está trabajando con Emma Stone",https://elcomercio.pe/mag/fama/celebs/no-se-si-puedo-anunciar-esto-pero-lo-voy-a-hacer-jennifer-lawrence-y-la-nueva-pelicula-en-la-que-esta-trabajando-con-emma-stone-celebs-nnda-nnrt-noticia/,"Fri, 07 Nov 2025 21:10:56 +0000",La información que brindó la artista en el pódcast ‘Las Culturistas’ no deja de generar reacciones en las redes sociales.,Sin categoría,El Comercio,https://elcomercio.pe/resizer/v2/RLNRRCU76JGMHOKQKK7CFESY4A.jpg?width=2400&height=1620&auth=96796b6d77eb3bb9c92b49692ec319d0bd48e0a3d842ad8f3198dfd3fa920510&smart=true,La información que brindó la artista en el pódcast ‘Las Culturistas’ no deja de generar reacciones en las redes sociales.
"Lima se sigue consolidando como capital culinaria y cultural de Sudamérica, según informe de Airbnb",https://elcomercio.pe/somos/estilo/lima-se-sigue-consolidando-como-capital-culinaria-y-cultural-de-sudamerica-segun-informe-de-airbnb-noticia/,"Fri, 07 Nov 2025 21:09:01 +0000",,Sin categoría,El Comercio,https://elcomercio.pe/resizer/v2/SSGRC3M5LZC2LM7CBYCU5MPLG4.jpeg?width=1024&height=767&auth=f3733c206d7316e4702305e4b6ddd8774a74aaad43cd7ed770cdf92b839eb8ac&smart=true,
