titulo,enlace,fecha,descripcion,categoria,fuente,imagen,contenido
"Superclásico Boca vs. River EN VIVO GRATIS: a qué hora juega, canales TV y dónde ver EN DIRECTO el Torneo Clausura Betano 2025",https://gestion.pe/mix/sports/superclasico-boca-vs-river-en-vivo-gratis-a-que-hora-juega-canales-tv-y-donde-ver-en-directo-el-torneo-clausura-betano-2025-nnda-nnse-noticia/,"Sun, 09 Nov 2025 01:00:00 +0000","Superclásico Boca vs. River EN VIVO este 9 de noviembre por el Torneo Clausura Betano 2025. Consulta horarios, canales TV y dónde ver GRATIS el partido desde Argentina, México, EE.UU. y España.",Sin categoría,Gestión,https://gestion.pe/resizer/v2/3UFG5MNUJ5GONG2W3V4JWQWQOA.jpg?width=2400&height=1600&auth=f3fb4f72432ae835c72f8d227b33d426684970d4c16361c456537678a75c53e7&smart=true,"Superclásico Boca vs. River EN VIVO este 9 de noviembre por el Torneo Clausura Betano 2025. Consulta horarios, canales TV y dónde ver GRATIS el partido desde Argentina, México, EE.UU. y España."
SNAP no se detiene: los estados que activaron fondos locales para asegurar la ayuda alimentaria,https://gestion.pe/mix/usa/snap-no-se-detiene-los-estados-que-activaron-fondos-locales-para-asegurar-la-ayuda-alimentaria-nnda-nnlt-noticia/,"Sun, 09 Nov 2025 00:50:13 +0000",Cierre de gobierno no detiene la ayuda. Los estados que protegen a las familias con cupones SNAP.,Sin categoría,Gestión,https://gestion.pe/resizer/v2/VJVDIGW76ZB75JRLDZVLTUM2II.jpg?width=1740&height=990&auth=09b89d9de288adc24602a834bc4b2730fe856fd44aa56aa287232a4c0ed5eab1&smart=true,Cierre de gobierno no detiene la ayuda. Los estados que protegen a las familias con cupones SNAP.
"Banco Central de Perú compró dólares por primera vez en cinco años, ¿por qué?",https://gestion.pe/economia/banco-central-de-peru-compro-dolares-por-primera-vez-en-cinco-anos-por-que-noticia/,"Sun, 09 Nov 2025 00:26:00 +0000","El sol es la moneda más estable de América Latina, considerando sus fluctuaciones históricas, según datos de Bloomberg.",Sin categoría,Gestión,https://gestion.pe/resizer/v2/5FFAMPNOUJHJZGHU5J5UU6QBMI.jpg?width=1200&height=714&auth=408f67072534e70da9b4e1c5c9f5166d46810d18acd16fd0b47f9cd658a424fb&smart=true,"El sol es la moneda más estable de América Latina, considerando sus fluctuaciones históricas, según datos de Bloomberg."
"Los 10 trabajos mejor pagados que puedes conseguir ahora mismo (y superan los US$100,000)",https://gestion.pe/mix/usa/los-10-trabajos-mejor-pagados-que-puedes-conseguir-ahora-mismo-y-superan-los-us100000-nnda-nnlt-noticia/,"Sat, 08 Nov 2025 23:17:05 +0000","Las profesiones que pagan más de US$100,000 al año. Descubre si calificas.",Sin categoría,Gestión,https://gestion.pe/resizer/v2/2UWARLDLSJFWZAUM3L3QENSCCM.jpg?width=1740&height=990&auth=171b0781d9c391394c1f0c91595fdf8dbd39fe0a59182d37dc4ba15c5aa8a37e&smart=true,"Las profesiones que pagan más de US$100,000 al año. Descubre si calificas."
Alicorp refuerza su receta: nuevos lanzamientos y más innovación en su negocio de pastas,https://gestion.pe/economia/empresas/alicorp-busca-la-formula-para-mantener-su-ventaja-en-el-mercado-maduro-de-las-pastas-noticia/,"Sat, 08 Nov 2025 23:13:14 +0000","La compañía de Alicorp redefine su estrategia en pastas, combinando innovación, diversificación de canales y presencia regional para mantener su crecimiento sostenido.",Sin categoría,Gestión,https://gestion.pe/resizer/v2/L2SH7ADZCZHP3LI3B5TOPLY5K4.jpg?width=809&height=512&auth=e1a3ea70d82a07bfbc3b5fda456fba359a09e36b40646c6836d9fcd32ef55f66&smart=true,"La compañía de Alicorp redefine su estrategia en pastas, combinando innovación, diversificación de canales y presencia regional para mantener su crecimiento sostenido."
"Déficit de cobre en el mundo se exacerbaría en 2026, ¿cómo se mueven los inversionistas?",https://gestion.pe/tu-dinero/cobre-deficit-en-el-mundo-se-exacerbaria-en-2026-como-se-mueven-los-inversionistas-noticia/,"Sat, 08 Nov 2025 22:55:55 +0000","El cobre es nuestro principal producto de exportación. Al cierre de este artículo, su precio estaba en US$ 4.96 la libra, ¿cuáles son las perspectivas en el corto y mediano plazo?",Sin categoría,Gestión,https://gestion.pe/resizer/v2/4DPBF735ENERREO4KGSTQLMYDA.jpg?width=1200&height=800&auth=fd1fcb1d36ab74f2fcaf997703c7520b2f9d00f86a1e079e6858d9558f6dcbd0&smart=true,"El cobre es nuestro principal producto de exportación. Al cierre de este artículo, su precio estaba en US$ 4.96 la libra, ¿cuáles son las perspectivas en el corto y mediano plazo?"
"IATA se reunió con MTC: Lo puntos que trataron, entre ellos que la TUUA desaparezca",https://gestion.pe/economia/iata-tras-reunion-con-mtc-hay-ciertas-alternativas-una-es-que-la-tuua-desaparezca-dice-peter-cerda-noticia/,"Sat, 08 Nov 2025 14:43:36 +0000","Peter Cerdá, vocero de IATA, conversó con el MTC sobre la TUUA y fue enfático: debe eliminarse para que el transporte aéreo peruano consiga competitividad.",Sin categoría,Gestión,https://gestion.pe/resizer/v2/J5OZIKQWCNHTZBZHVJSG5ZKGFI.jpg?width=5472&height=3648&auth=c3b3b90afcb2e6cb39a27df1ae6b6c2cfa229fb9d1f08680448c34dcd7c4d040&smart=true,"Peter Cerdá, vocero de IATA, conversó con el MTC sobre la TUUA y fue enfático: debe eliminarse para que el transporte aéreo peruano consiga competitividad."
Minería ilegal avanza en La Libertad: ¿qué viene fallando? esto dice el gobierno regional,https://gestion.pe/economia/mineria-ilegal-avanza-en-la-libertad-que-viene-fallando-esto-dice-el-gobierno-regional-noticia/,"Sat, 08 Nov 2025 22:30:46 +0000","La economía de La Libertad tuvo un mínimo avance en el primer semestre del año, expandiéndose tan solo un 0.8%, según reportó el INEI. Sin embargo, esperan un repunte significativo de su actividad.",Sin categoría,Gestión,https://gestion.pe/resizer/v2/7OH2AAPKXJGGTCTH6LJZYSF7W4.jpg?width=2756&height=1838&auth=c11f834da90b692e1e94f4d95b4ce0c0d5062fd6be3ec6925741170f0dd53a9f&smart=true,"La economía de La Libertad tuvo un mínimo avance en el primer semestre del año, expandiéndose tan solo un 0.8%, según reportó el INEI. Sin embargo, esperan un repunte significativo de su actividad."
Rodrigo Paz al asumir la presidencia de Bolivia: “¿Dónde está el litio y el gas?”,https://gestion.pe/mundo/internacional/rodrigo-paz-al-asumir-la-presidencia-de-bolivia-donde-esta-el-litio-y-el-gas-noticia/,"Sat, 08 Nov 2025 22:03:16 +0000","El presidente constitucional de Bolivia, Rodrigo Paz Pereira, inició su gestión con un duro cuestionamiento a los expresidentes Evo Morales y Luis Arce, al preguntar públicamente “¿dónde está el litio y dónde está el gas?”, recursos cuya abundancia -dijo- fue “prometida y nunca demostrada” durante los años de predominio del Movimiento al Socialismo (MAS).",Sin categoría,Gestión,https://gestion.pe/resizer/v2/STCWW5JVUBHYBACRLB4Z2AN32Y.jpg?width=1200&height=800&auth=ccaf415a599b9820394744b53ef1dde92df0a72888eed713cfcbb485f3c67dfd&smart=true,"El presidente constitucional de Bolivia, Rodrigo Paz Pereira, inició su gestión con un duro cuestionamiento a los expresidentes Evo Morales y Luis Arce, al preguntar públicamente “¿dónde está el litio y dónde está el gas?”, recursos cuya abundancia -dijo- fue “prometida y nunca demostrada” durante los años de predominio del Movimiento al Socialismo (MAS)."
ONPE rechaza inscripción de Martín Vizcarra a la plancha de Perú Primero,https://gestion.pe/peru/politica/onpe-rechaza-inscripcion-de-martin-vizcarra-a-la-plancha-de-peru-primero-noticia/,"Sat, 08 Nov 2025 21:36:22 +0000","La Oficina Nacional de Procesos Electorales (ONPE) retiró la inscripción de Martín Vizcarra como precandidato a la Primera Vicepresidencia por Perú Primero, dejando al exmandatario -inhabilitado por el Congreso- sin la posibilidad de competir en las elecciones internas de su partido.",Sin categoría,Gestión,https://gestion.pe/resizer/v2/L376JSCZONG4HEUMIHN32VMXXU.jpeg?width=4160&height=2773&auth=7f0ee1e832346baf64dd563c83bc4a6fd8733274d458d0a0e88d0fb5d49af5e1&smart=true,"La Oficina Nacional de Procesos Electorales (ONPE) retiró la inscripción de Martín Vizcarra como precandidato a la Primera Vicepresidencia por Perú Primero, dejando al exmandatario -inhabilitado por el Congreso- sin la posibilidad de competir en las elecciones internas de su partido."
¿La aprueban o no? Esto está diciendo la crítica especializada sobre “Maxton Hall” - Temporada 2,https://gestion.pe/mix/tendencias-mix/la-aprueban-o-no-esto-esta-diciendo-la-critica-especializada-sobre-maxton-hall-temporada-2-amazon-prime-video-nnda-nnlt-noticia/,"Sat, 08 Nov 2025 21:01:53 +0000","La segunda temporada de “Maxton Hall: The World Between Us”, estrenada el 7 de noviembre de 2025, transforma el romance adolescente en un oscuro drama, explorando duelo y poder, y polariza a críticos con su giro narrativo y la dominación del villano.",Sin categoría,Gestión,https://gestion.pe/resizer/v2/L3FBHN4K4JESPFGGONJVFU7JFM.jpg?width=2320&height=1320&auth=db9c0e6b05aceb75d5d9bf28cbc0554e9211d9949bb415e697391405630eaba6&smart=true,"La segunda temporada de “Maxton Hall: The World Between Us”, estrenada el 7 de noviembre de 2025, transforma el romance adolescente en un oscuro drama, explorando duelo y poder, y polariza a críticos con su giro narrativo y la dominación del villano."
"Números ganadores, Mega Millions del viernes 07 de noviembre: resultados y mira si salió el premio mayor de 843 millones de dólares",https://gestion.pe/mix/loterias/numeros-ganadores-mega-millions-en-vivo-hoy-07-de-noviembre-resultados-y-mira-si-salio-el-premio-mayor-de-843-millones-de-dolares-nnda-nnse-noticia/,"Sat, 08 Nov 2025 20:11:49 +0000","El sorteo del Mega Millions de este viernes 7 de octubre repartía un jackpot de $843 millones. Mira los números ganadores, conoce los resultados completos y verifica si tu boleto es el afortunado.",Sin categoría,Gestión,https://gestion.pe/resizer/v2/3CGCALPQ4ZAFDC6Q6TPCEAD5VM.jpg?width=2400&height=1609&auth=6b265a396741bc71168452d77903efa81ca8ffa21dc995b708a2e7af23e29cd6&smart=true,"El sorteo del Mega Millions de este viernes 7 de octubre repartía un jackpot de $843 millones. Mira los números ganadores, conoce los resultados completos y verifica si tu boleto es el afortunado."
Mega Millions del 07/11/2025: números ganadores y resultados del jackpot de $843 millones en EE.UU.,https://gestion.pe/mix/loterias/mega-millions-hoy-07112025-numeros-ganadores-en-vivo-y-resultados-del-jackpot-de-843-millones-en-eeuu-nnda-nnse-noticia/,"Sat, 08 Nov 2025 20:11:38 +0000",Revisa los resultados del Mega Millions del 7 de noviembre de 2025 y entérate si hubo ganador del sorteo con un premio mayor acumulado de 843 millones de dólares.,Sin categoría,Gestión,https://gestion.pe/resizer/v2/P5XORNR4UBDHPEQDVNTZOZH3WQ.jpg?width=2400&height=1609&auth=f815478f6bf7f9d86bbf622f5449a60f043cc069133959a5eac2e564e3f5d950&smart=true,Revisa los resultados del Mega Millions del 7 de noviembre de 2025 y entérate si hubo ganador del sorteo con un premio mayor acumulado de 843 millones de dólares.
"Los 6 errores que alerta a los reclutadores en una entrevista laboral, ¿cuáles son?",https://gestion.pe/g-de-gestion/lifestyle/los-6-errores-que-alerta-a-los-reclutadores-en-una-entrevista-laboral-cuales-son-noticia/,"Sat, 08 Nov 2025 20:04:00 +0000",Este artículo de Harvard Business Review explora seis categorías principales de preocupación para quienes participan en el proceso de reclutamiento laboral.,Sin categoría,Gestión,https://gestion.pe/resizer/v2/FGY5WPVUVRCVJIDCK33DWHKC3M.jpg?width=1200&height=800&auth=2e4d4615fff6df6d80125a61cf5767e6dc987834e56730eb9de7028940ea72fc&smart=true,Este artículo de Harvard Business Review explora seis categorías principales de preocupación para quienes participan en el proceso de reclutamiento laboral.
Empresas familiares peruanas y su diversificación: ¿Cuál es el sector más atractivo?,https://gestion.pe/g-de-gestion/infografias/empresas-familiares-miran-a-este-sector-como-la-primera-opcion-para-diversificarse-noticia/,"Sat, 08 Nov 2025 20:00:00 +0000",Las empresas familiares en Perú tienen un peso relevante en el PBI del país. Existen datos importantes que reflejan su desarrollo e impacto en la economía nacional.,Sin categoría,Gestión,https://gestion.pe/resizer/v2/QNS5LOW7NFBTPJK6ZPJDO2OSWU.jpg?width=1350&height=900&auth=15ca53f93f8b00e490cabbe778983064d2a1384d666637d75286f6feadcd1a78&smart=true,Las empresas familiares en Perú tienen un peso relevante en el PBI del país. Existen datos importantes que reflejan su desarrollo e impacto en la economía nacional.
¿Vender y cobrar por redes sociales?: Guía práctica para emprendedores,https://gestion.pe/tu-dinero/vender-y-cobrar-por-redes-sociales-guia-practica-para-emprendedores-noticia/,"Sat, 08 Nov 2025 19:35:54 +0000","Las redes sociales ya no solo sirven para mostrar productos: hoy son uno de los principales motores de venta para emprendedores y pequeños negocios. Según Osiptel, en su última data disponible del tema, más del 91% de los peruanos usa internet para acceder a redes sociales, lo que convierte a estas plataformas en un espacio natural para concretar compras.",Sin categoría,Gestión,https://gestion.pe/resizer/v2/GTTMIBBB3BBJVJ5IYBXGTLNOI4.jpeg?width=1600&height=1066&auth=80e2063bdb169e687e35e5cc62b9d4febe5a7b5af3f85a2e737deda103d42876&smart=true,"Las redes sociales ya no solo sirven para mostrar productos: hoy son uno de los principales motores de venta para emprendedores y pequeños negocios. Según Osiptel, en su última data disponible del tema, más del 91% de los peruanos usa internet para acceder a redes sociales, lo que convierte a estas plataformas en un espacio natural para concretar compras."
Jerí: Nuevas medidas por estado de emergencia “dan más herramientas para actuar contra la delincuencia”,https://gestion.pe/peru/jeri-nuevas-medidas-por-estado-de-emergencia-dan-mas-herramientas-para-actuar-contra-la-delincuencia-noticia/,"Sat, 08 Nov 2025 19:04:52 +0000","El presidente José Jerí Oré informó que la actualización del estado de emergencia aprobada por el Gobierno incluye un paquete de medidas orientadas a reforzar la capacidad operativa del Estado frente al avance de la delincuencia, especialmente en Lima, donde se concentra más del 50% de los hechos delictivos del país.",Sin categoría,Gestión,https://gestion.pe/resizer/v2/N6FAZVUILNHSBNL6PWJMQU7DD4.jpg?width=5472&height=3648&auth=12e52f96fb79f3a4f007b765a799cd38d0e2cfa60f6093601735762becbb3def&smart=true,"El presidente José Jerí Oré informó que la actualización del estado de emergencia aprobada por el Gobierno incluye un paquete de medidas orientadas a reforzar la capacidad operativa del Estado frente al avance de la delincuencia, especialmente en Lima, donde se concentra más del 50% de los hechos delictivos del país."
¿Reprogramación o refinanciamiento? Los errores y las clave para ordenar tus gastos,https://gestion.pe/tu-dinero/finanzas-personales/reprogramacion-o-refinanciamiento-los-errores-y-las-claves-para-ordenar-tus-gastos-noticia/,"Sat, 08 Nov 2025 18:45:30 +0000","En tiempos de bolsillos ajustados, cada sol cuenta. Y cuando los ingresos no alcanzan para cubrir las cuotas, muchos peruanos enfrentan la misma disyuntiva: ¿reprogramar o refinanciar sus deudas? Aunque suenen parecidos, ambos caminos tienen efectos muy distintos sobre el historial crediticio y la salud financiera.",Sin categoría,Gestión,https://gestion.pe/resizer/v2/7YDNSL2ALNCAPO4C4ZC3QI55NM.jpg?width=612&height=408&auth=af68a44096fd489d15f8df752229a669cdf7c85e278c6cccaf6d8e4f86e9748a&smart=true,"En tiempos de bolsillos ajustados, cada sol cuenta. Y cuando los ingresos no alcanzan para cubrir las cuotas, muchos peruanos enfrentan la misma disyuntiva: ¿reprogramar o refinanciar sus deudas? Aunque suenen parecidos, ambos caminos tienen efectos muy distintos sobre el historial crediticio y la salud financiera."
Crece el boom de jóvenes que compran su departamento para alquilar: las preferencias,https://gestion.pe/tu-dinero/inmobiliarias/crece-el-boom-de-jovenes-que-compran-su-departamento-para-alquilar-las-preferencias-noticia/,"Sat, 08 Nov 2025 18:06:25 +0000","La idea de independizarse ya no pasa por buscar roommates ni pagar un alquiler cada mes. Una nueva generación de jóvenes peruanos está dando un salto directo hacia la propiedad, impulsada por cuotas hipotecarias competitivas, bonos estatales y una mentalidad financiera más orientada al patrimonio.",Sin categoría,Gestión,https://gestion.pe/resizer/v2/5TEMQEK4TNDXDLNAXONXT2TDR4.jpeg?width=2048&height=1270&auth=4f1d3ee67eb168548173b7f71cabc493d594710c093bc114a4c2833ab14a97d0&smart=true,"La idea de independizarse ya no pasa por buscar roommates ni pagar un alquiler cada mes. Una nueva generación de jóvenes peruanos está dando un salto directo hacia la propiedad, impulsada por cuotas hipotecarias competitivas, bonos estatales y una mentalidad financiera más orientada al patrimonio."
Brass abre sus puertas en la Avenida Conquistadores: ¿un festín culinario para todos?,https://gestion.pe/g-de-gestion/lifestyle/brass-restaurante-el-nuevo-vecino-de-la-avenida-conquistadores-experiencia-gastronomica-en-san-isidro-noticia/,"Sat, 08 Nov 2025 18:00:00 +0000","Además de una carta permanente, cada cierto tiempo, el restaurante Brass de San Isidro ofrece experiencias creadas por su chef o en alianza con algún invitado.",Sin categoría,Gestión,https://gestion.pe/resizer/v2/WPYOENADWFFC3BGO6AOIEPFNUU.jpg?width=3750&height=2500&auth=5816b6f8950e5624095f9711ad05178d624263b5fdec324d4c28bf96892f0187&smart=true,"Además de una carta permanente, cada cierto tiempo, el restaurante Brass de San Isidro ofrece experiencias creadas por su chef o en alianza con algún invitado."
MEF transfiere S/ 317 millones a la ANIN para asegurar continuidad de obras ante inundaciones,https://gestion.pe/economia/mef-transfiere-s-317-millones-a-la-anin-para-asegurar-continuidad-de-obras-ante-inundaciones-noticia/,"Sat, 08 Nov 2025 17:50:29 +0000","El Ministerio de Economía y Finanzas (MEF) autorizó la transferencia de S/ 317,184,201 a favor de la Autoridad Nacional de Infraestructura (ANIN), con el fin de garantizar la continuidad de obras prioritarias de protección ante inundaciones en diversas regiones del país. Los recursos permitirán que intervenciones ya en ejecución no se detengan y mantengan su ritmo de avance.",Sin categoría,Gestión,https://gestion.pe/resizer/v2/2ZFNW4JIRRH5HIBOTEN5NTJTOQ.jpeg?width=1024&height=576&auth=9247a79f5cbfa1423dd1c202e9d8d39b5d19fb18a729fe94746a9d5ae3fddfb3&smart=true,"El Ministerio de Economía y Finanzas (MEF) autorizó la transferencia de S/ 317,184,201 a favor de la Autoridad Nacional de Infraestructura (ANIN), con el fin de garantizar la continuidad de obras prioritarias de protección ante inundaciones en diversas regiones del país. Los recursos permitirán que intervenciones ya en ejecución no se detengan y mantengan su ritmo de avance."
Moda peruana en Canadá: diseños y accesorios sostenibles concretan negocios en Toronto,https://gestion.pe/peru/moda-peruana-en-canada-disenos-y-accesorios-sostenibles-concretan-negocios-en-toronto-noticia/,"Sat, 08 Nov 2025 17:36:37 +0000","Un grupo de ocho empresas peruanas mostraron su talento y diseños en la ARTA Gallery del Distillery District de Canadá, durante el Peruvian Fashion Showcase. Las marcas Pangea, Incalpaca, Andes Connection, Alexandra Temple, Galera, Vanessa Osorio, Alwa Perú y Ama Alpaca contaron con un espacio destacado para exhibir sus productos, una presentación en vivo con modelos peruanas y canadienses, así como la posibilidad de generar vínculos estratégicos dentro del mercado canadiense.",Sin categoría,Gestión,https://gestion.pe/resizer/v2/YUAUJP774BEWFPX7L5JGVGTNOM.png?width=1200&height=769&auth=0f33a7984bd1e9f27dcffe9ef8b67f3f4fd75428bab3be55daf994228d497d4b&smart=true,"Un grupo de ocho empresas peruanas mostraron su talento y diseños en la ARTA Gallery del Distillery District de Canadá, durante el Peruvian Fashion Showcase. Las marcas Pangea, Incalpaca, Andes Connection, Alexandra Temple, Galera, Vanessa Osorio, Alwa Perú y Ama Alpaca contaron con un espacio destacado para exhibir sus productos, una presentación en vivo con modelos peruanas y canadienses, así como la posibilidad de generar vínculos estratégicos dentro del mercado canadiense."
"¿Qué pasó en GESTIÓN un día como hoy, 8 de noviembre?",https://gestion.pe/tendencias/que-paso-en-gestion-un-dia-como-hoy-8-de-noviembre-2025-noticia/,"Sat, 08 Nov 2025 17:33:05 +0000","EFEMÉRIDES. “Fijan nuevos requisitos para comprobantes de pago”. “Ica tendrá otro centro comercial en el 2011”. Recuerde a través de las páginas del archivo del diario GESTIÓN los momentos más importantes de la historia contemporánea de la economía peruana, un día como hoy.",Sin categoría,Gestión,https://gestion.pe/resizer/v2/24M755WLMZBV7MEMHKURCEAUQI.jpg?width=2000&height=1128&auth=7d1990e114747296c3042e16547d153a8903a3aa76fafcd13893a5bba69c7c2c&smart=true,"EFEMÉRIDES. “Fijan nuevos requisitos para comprobantes de pago”. “Ica tendrá otro centro comercial en el 2011”. Recuerde a través de las páginas del archivo del diario GESTIÓN los momentos más importantes de la historia contemporánea de la economía peruana, un día como hoy."
MTC acelera recuperación definitiva de tramo socavado en la Av. Néstor Gambetta,https://gestion.pe/peru/mtc-acelera-recuperacion-definitiva-de-tramo-socavado-en-la-av-nestor-gambetta-noticia/,"Sat, 08 Nov 2025 17:25:42 +0000","El Ministerio de Transportes y Comunicaciones (MTC), a través de Provías Nacional, avanza en el proceso para recuperar de manera definitiva el sector de la Av. Néstor Gambetta afectado por socavación.",Sin categoría,Gestión,https://gestion.pe/resizer/v2/E5BGTZSWNJAKVDOIGOXGMHASPI.jpeg?width=1599&height=1066&auth=f1986b193aa93b2908775b41a9258cfed2eedef3da151124cbd722a6fe572b79&smart=true,"El Ministerio de Transportes y Comunicaciones (MTC), a través de Provías Nacional, avanza en el proceso para recuperar de manera definitiva el sector de la Av. Néstor Gambetta afectado por socavación."
Rodrigo Paz asume la presidencia de Bolivia y cierra un ciclo de 20 años de socialismo,https://gestion.pe/mundo/internacional/rodrigo-paz-asume-la-presidencia-de-bolivia-y-cierra-un-ciclo-de-20-anos-de-socialismo-noticia/,"Sat, 08 Nov 2025 17:01:04 +0000","El centroderechista Rodrigo Paz asumió este sábado la presidencia de Bolivia y puso fin a dos décadas de gobiernos socialistas, en un momento marcado por la peor crisis económica en 40 años.",Sin categoría,Gestión,https://gestion.pe/resizer/v2/K44JAXJ72ZHYZNEIEJLIAU5ARE.jpg?width=1200&height=800&auth=7ff4d1762c10d6549ba0a9359e3fe172bea505e4d13c9e09fe54483ca8e8f6f2&smart=true,"El centroderechista Rodrigo Paz asumió este sábado la presidencia de Bolivia y puso fin a dos décadas de gobiernos socialistas, en un momento marcado por la peor crisis económica en 40 años."
Anuncios de trabajo registran pico en casi 6 años: ¿para plazas temporales o permanentes?,https://gestion.pe/economia/anuncios-de-trabajo-registran-pico-segun-bcrp-y-no-se-debe-al-empleo-temporal-ipe-y-upc-explican-causas-noticia/,"Sat, 08 Nov 2025 16:59:39 +0000","El BCRP ha compartido el número de avisos de empleo hasta octubre. Con ello, el país ha batido un récord desde el 2020, ¿por qué?",Sin categoría,Gestión,https://gestion.pe/resizer/v2/KDEWJVET6JDV3OSBBS2NCBHDRQ.png?width=977&height=652&auth=621886d971ffd82c2f668da85fdc5f999c014ce737cc55e8df718ec0ca6f94d5&smart=true,"El BCRP ha compartido el número de avisos de empleo hasta octubre. Con ello, el país ha batido un récord desde el 2020, ¿por qué?"
"Telefónica reduce su deuda en 1,800 millones de euros con su reordenación en Latinoamérica",https://gestion.pe/mundo/internacional/telefonica-reduce-su-deuda-en-1800-millones-de-euros-con-su-reordenacion-en-latinoamerica-noticia/,"Sat, 08 Nov 2025 16:45:28 +0000","Telefónica recortará su deuda en 1,800 millones de euros una vez que contabilice las operaciones corporativas que tiene pendientes en Latinoamérica -Uruguay, Ecuador, Colombia y Brasil-, con lo que se quedará en 26,500 millones.",Sin categoría,Gestión,https://gestion.pe/resizer/v2/QGOXBCFRSBBMHH5F2QPCOMHVQU.jpg?width=1200&height=800&auth=031b82f6a5add2c1541eab9d6cd6f8d0cdc5bda5b151f568c096cb5d8f983429&smart=true,"Telefónica recortará su deuda en 1,800 millones de euros una vez que contabilice las operaciones corporativas que tiene pendientes en Latinoamérica -Uruguay, Ecuador, Colombia y Brasil-, con lo que se quedará en 26,500 millones."
La cena por el Día de Acción de Gracias ahora cuesta menos: estas son las razones,https://gestion.pe/mix/usa/la-cena-por-el-dia-de-accion-de-gracias-ahora-cuesta-menos-estas-son-las-razones-estados-unidos-nnda-nnlt-noticia/,"Sat, 08 Nov 2025 16:08:54 +0000","Este 2025, la cena de Acción de Gracias sorprende con una disminución de costos que varía entre el 2% y 3%, según un informe de Wells Fargo, ofreciendo un alivio inesperado en tiempos de inflación constante.",Sin categoría,Gestión,https://gestion.pe/resizer/v2/JZLGVKJPFREEFNGABA2D36GXYA.jpg?width=2320&height=1320&auth=d7bc544fbfd6acf3dfcd10045e93457a4c2e7dde3906041fde680257a89c6cf7&smart=true,"Este 2025, la cena de Acción de Gracias sorprende con una disminución de costos que varía entre el 2% y 3%, según un informe de Wells Fargo, ofreciendo un alivio inesperado en tiempos de inflación constante."
